{"html":"<div dir=\"ltr\"><div class=\"gmail_default\" style=\"font-family:tahoma,sans-serif;font-size:small\">asdfasdf</div></div>\n","text":"asdfasdf\n","headers":{"delivered-to":"louis@sundaystori.es","received":["by 10.236.140.137 with SMTP id b9csp1450392pjo; Tue, 13 Mar 2018 16:52:05 -0700 (PDT)","from mail-sor-f41.google.com (mail-sor-f41.google.com. [209.85.220.41]) by mx.google.com with SMTPS id v64sor596633vka.67.2018.03.13.16.52.05 for <louis@sundaystori.es> (Google Transport Security); Tue, 13 Mar 2018 16:52:05 -0700 (PDT)","by 10.31.10.8 with HTTP; Tue, 13 Mar 2018 16:52:04 -0700 (PDT)"],"x-received":["by 10.31.147.87 with SMTP id v84mr1918077vkd.37.1520985125765; Tue, 13 Mar 2018 16:52:05 -0700 (PDT)","by 10.31.199.6 with SMTP id x6mr1931862vkf.6.1520985125067; Tue, 13 Mar 2018 16:52:05 -0700 (PDT)"],"arc-seal":"i=1; a=rsa-sha256; t=1520985125; cv=none; d=google.com; s=arc-20160816; b=x8vzr8Ureh4puuEIH7y97MWbhyJHJyQzvZDDfr94KGooGPsV0JE/se2rDAq2hLn+BS yDM+zJeAfv1m2vQU8F//Kw+YiVlkyzt3/gBri4bd/XWFC6U9e8D6/LUQJ8xh2vtKXE2G foedCqIGozrOXOu1dpRqUqX2YFMNWbVwvAIugiPOsXrMEefjr8wZl0Gb9kF/q8SAgFQw E0IPJ/J9AaN8W7hhGgwUyRtycWvdu2icTc+aANMVHpbcGk1zN1l4HQLcWx2bvC5llkhv LHO7u+fSht+QLMH1POutq4/UAeZ0daYGHBNx4zicy1rpx22MqO3SZEerm7R53HMB/9vS HySQ==","arc-message-signature":"i=1; a=rsa-sha256; c=relaxed/relaxed; d=google.com; s=arc-20160816; h=to:subject:message-id:date:from:mime-version:dkim-signature :arc-authentication-results; bh=UbmH2H1LWeRkfh4UocLimaWuih/zwEy5dxjhxuFukZY=; b=EHFO+Da9C0XMp9xeJapkyQimkEDHx0YACdfTknLbmKturSI1S3UZM9P+bf3enzHNW8 Cc2fkVJTpnYbMNWBSUPekjKeHPPWM/1f4stQBsYycy0ynDb45BXSEe5Z2+vBXgDoyCoY jP61Kj1D7Y36E0posDKRa6A+MzlNiTNIBn9PHam/KeXqAtqVBMrd+XLzoClpGi5NT9Cj y3w82zzfJ+SfeWlwMXOEMnyTvippyv0eQqQWHJYnXoSEuDOP50LzZykv1y9HhYh3sevQ NNLxz8NPhagycCtDg32V7rvrS5/FVZUlX3cAgrt8e5ueUCacF1pZWv3C2i5ZQq6z7v/w arUA==","arc-authentication-results":"i=1; mx.google.com; dkim=pass header.i=@gmail.com header.s=20161025 header.b=ZxQbzzmS; spf=pass (google.com: domain of louis.barclay@gmail.com designates 209.85.220.41 as permitted sender) smtp.mailfrom=louis.barclay@gmail.com; dmarc=pass (p=NONE sp=QUARANTINE dis=NONE) header.from=gmail.com","return-path":"<louis.barclay@gmail.com>","received-spf":"pass (google.com: domain of louis.barclay@gmail.com designates 209.85.220.41 as permitted sender) client-ip=209.85.220.41;","authentication-results":"mx.google.com; dkim=pass header.i=@gmail.com header.s=20161025 header.b=ZxQbzzmS; spf=pass (google.com: domain of louis.barclay@gmail.com designates 209.85.220.41 as permitted sender) smtp.mailfrom=louis.barclay@gmail.com; dmarc=pass (p=NONE sp=QUARANTINE dis=NONE) header.from=gmail.com","dkim-signature":"v=1; a=rsa-sha256; c=relaxed/relaxed; d=gmail.com; s=20161025; h=mime-version:from:date:message-id:subject:to; bh=UbmH2H1LWeRkfh4UocLimaWuih/zwEy5dxjhxuFukZY=; b=ZxQbzzmSeDfEqHAe6SGNkkayau+6/OaXcRoGtT5XSjdx2ut4zL3vFO1P7No5BGJw6W k0FefEYpkKiIwR/OFDqShToxhWzb8Ud4uFnGU/26Ps9uWnaY3qzg0ZSySonuHzm5F1os GFOXRWyD8bPNtRr6hWBV94xKBymWpBS/76yS8tLaVkDSvg8VVxFkm5DRGN73QFp4Vad6 yhtZrveK69d//Vmyb+R8frWEN0vQ4UJvDADZL72zWvSpMivIunFHBk7s88htjjH2n5WC BZCJOvqdV/sXN8EyDYxzThDGyP1g50Cb2SCXrO20n9u2vUgvAskK7SOAhBAqS8mXKlg5 SFLw==","x-google-dkim-signature":"v=1; a=rsa-sha256; c=relaxed/relaxed; d=1e100.net; s=20161025; h=x-gm-message-state:mime-version:from:date:message-id:subject:to; bh=UbmH2H1LWeRkfh4UocLimaWuih/zwEy5dxjhxuFukZY=; b=E0pGrIgkrteHyVm6rduCReYQm1JMO8tcYIbDzuWzqmYwWA5WbSjLV5mu6LRhV/8i7n GwSga5KfPNu4AQ4R2Pj8Z5Hq47zruRjD06K2qN0TuSUaF4EOo+7/siUZqlfb6/JSu5G7 5qEyDoLw2uR1XBXwp7hNMydf8UZdohPwFYYihqKTOrK5a9i4CGJZb3p/2gOwZ/qumEgB 0iK516+ncYXz8tN2U0HYLM3eeC21d5fpvQl1NfvkAgZvsm3bfs8IdUkitpc2w7G5ByYb B63GnUDCKwR91WxpEYxAP2yFMab/WZJLRTDYR02I1JZYnZ4ne7VMh8aNWRzswoVsLp70 DdZg==","x-gm-message-state":"AElRT7FgXRmMIHd8gb6fR/eYLVrv/mZ+UtEcKIOw5gXyxVJjeMDTI9M1 1S3R/qxrK5tNBwEjT2ytXOcAHjmbLItW30pGVXUuyA==","x-google-smtp-source":"AG47ELtqmWDQOyF0c5WJKV3mjXc9lYA7hQlLDRtR+bbflTESlj9V4nt4X8v1EnqL2HEWY3jU8SzsRu6xLamTjSKCbAM=","mime-version":"1.0","from":"Louis Barclay <louis.barclay@gmail.com>","date":"Tue, 13 Mar 2018 23:52:04 +0000","message-id":"<CAL2-1RZtV1dbz+ZdaMh+kndHmqHWpvotFHeUKp8g4n4v1Gtz6g@mail.gmail.com>","subject":"asdfafd","to":"Louis Barclay <louis@sundaystori.es>","content-type":"multipart/alternative; boundary=\"001a114dddf016a5ab056753f279\""},"subject":"asdfafd","messageId":"CAL2-1RZtV1dbz+ZdaMh+kndHmqHWpvotFHeUKp8g4n4v1Gtz6g@mail.gmail.com","priority":"normal","from":[{"address":"louis.barclay@gmail.com","name":"Louis Barclay"}],"to":[{"address":"louis@sundaystori.es","name":"Louis Barclay"}],"date":"2018-03-13T23:52:04.000Z","receivedDate":"2018-03-13T23:52:05.000Z","eml":"Delivered-To: louis@sundaystori.es\r\nReceived: by 10.236.140.137 with SMTP id b9csp1450392pjo;\r\n        Tue, 13 Mar 2018 16:52:05 -0700 (PDT)\r\nX-Received: by 10.31.147.87 with SMTP id v84mr1918077vkd.37.1520985125765;\r\n        Tue, 13 Mar 2018 16:52:05 -0700 (PDT)\r\nARC-Seal: i=1; a=rsa-sha256; t=1520985125; cv=none;\r\n        d=google.com; s=arc-20160816;\r\n        b=x8vzr8Ureh4puuEIH7y97MWbhyJHJyQzvZDDfr94KGooGPsV0JE/se2rDAq2hLn+BS\r\n         yDM+zJeAfv1m2vQU8F//Kw+YiVlkyzt3/gBri4bd/XWFC6U9e8D6/LUQJ8xh2vtKXE2G\r\n         foedCqIGozrOXOu1dpRqUqX2YFMNWbVwvAIugiPOsXrMEefjr8wZl0Gb9kF/q8SAgFQw\r\n         E0IPJ/J9AaN8W7hhGgwUyRtycWvdu2icTc+aANMVHpbcGk1zN1l4HQLcWx2bvC5llkhv\r\n         LHO7u+fSht+QLMH1POutq4/UAeZ0daYGHBNx4zicy1rpx22MqO3SZEerm7R53HMB/9vS\r\n         HySQ==\r\nARC-Message-Signature: i=1; a=rsa-sha256; c=relaxed/relaxed; d=google.com; s=arc-20160816;\r\n        h=to:subject:message-id:date:from:mime-version:dkim-signature\r\n         :arc-authentication-results;\r\n        bh=UbmH2H1LWeRkfh4UocLimaWuih/zwEy5dxjhxuFukZY=;\r\n        b=EHFO+Da9C0XMp9xeJapkyQimkEDHx0YACdfTknLbmKturSI1S3UZM9P+bf3enzHNW8\r\n         Cc2fkVJTpnYbMNWBSUPekjKeHPPWM/1f4stQBsYycy0ynDb45BXSEe5Z2+vBXgDoyCoY\r\n         jP61Kj1D7Y36E0posDKRa6A+MzlNiTNIBn9PHam/KeXqAtqVBMrd+XLzoClpGi5NT9Cj\r\n         y3w82zzfJ+SfeWlwMXOEMnyTvippyv0eQqQWHJYnXoSEuDOP50LzZykv1y9HhYh3sevQ\r\n         NNLxz8NPhagycCtDg32V7rvrS5/FVZUlX3cAgrt8e5ueUCacF1pZWv3C2i5ZQq6z7v/w\r\n         arUA==\r\nARC-Authentication-Results: i=1; mx.google.com;\r\n       dkim=pass header.i=@gmail.com header.s=20161025 header.b=ZxQbzzmS;\r\n       spf=pass (google.com: domain of louis.barclay@gmail.com designates 209.85.220.41 as permitted sender) smtp.mailfrom=louis.barclay@gmail.com;\r\n       dmarc=pass (p=NONE sp=QUARANTINE dis=NONE) header.from=gmail.com\r\nReturn-Path: <louis.barclay@gmail.com>\r\nReceived: from mail-sor-f41.google.com (mail-sor-f41.google.com. [209.85.220.41])\r\n        by mx.google.com with SMTPS id v64sor596633vka.67.2018.03.13.16.52.05\r\n        for <louis@sundaystori.es>\r\n        (Google Transport Security);\r\n        Tue, 13 Mar 2018 16:52:05 -0700 (PDT)\r\nReceived-SPF: pass (google.com: domain of louis.barclay@gmail.com designates 209.85.220.41 as permitted sender) client-ip=209.85.220.41;\r\nAuthentication-Results: mx.google.com;\r\n       dkim=pass header.i=@gmail.com header.s=20161025 header.b=ZxQbzzmS;\r\n       spf=pass (google.com: domain of louis.barclay@gmail.com designates 209.85.220.41 as permitted sender) smtp.mailfrom=louis.barclay@gmail.com;\r\n       dmarc=pass (p=NONE sp=QUARANTINE dis=NONE) header.from=gmail.com\r\nDKIM-Signature: v=1; a=rsa-sha256; c=relaxed/relaxed;\r\n        d=gmail.com; s=20161025;\r\n        h=mime-version:from:date:message-id:subject:to;\r\n        bh=UbmH2H1LWeRkfh4UocLimaWuih/zwEy5dxjhxuFukZY=;\r\n        b=ZxQbzzmSeDfEqHAe6SGNkkayau+6/OaXcRoGtT5XSjdx2ut4zL3vFO1P7No5BGJw6W\r\n         k0FefEYpkKiIwR/OFDqShToxhWzb8Ud4uFnGU/26Ps9uWnaY3qzg0ZSySonuHzm5F1os\r\n         GFOXRWyD8bPNtRr6hWBV94xKBymWpBS/76yS8tLaVkDSvg8VVxFkm5DRGN73QFp4Vad6\r\n         yhtZrveK69d//Vmyb+R8frWEN0vQ4UJvDADZL72zWvSpMivIunFHBk7s88htjjH2n5WC\r\n         BZCJOvqdV/sXN8EyDYxzThDGyP1g50Cb2SCXrO20n9u2vUgvAskK7SOAhBAqS8mXKlg5\r\n         SFLw==\r\nX-Google-DKIM-Signature: v=1; a=rsa-sha256; c=relaxed/relaxed;\r\n        d=1e100.net; s=20161025;\r\n        h=x-gm-message-state:mime-version:from:date:message-id:subject:to;\r\n        bh=UbmH2H1LWeRkfh4UocLimaWuih/zwEy5dxjhxuFukZY=;\r\n        b=E0pGrIgkrteHyVm6rduCReYQm1JMO8tcYIbDzuWzqmYwWA5WbSjLV5mu6LRhV/8i7n\r\n         GwSga5KfPNu4AQ4R2Pj8Z5Hq47zruRjD06K2qN0TuSUaF4EOo+7/siUZqlfb6/JSu5G7\r\n         5qEyDoLw2uR1XBXwp7hNMydf8UZdohPwFYYihqKTOrK5a9i4CGJZb3p/2gOwZ/qumEgB\r\n         0iK516+ncYXz8tN2U0HYLM3eeC21d5fpvQl1NfvkAgZvsm3bfs8IdUkitpc2w7G5ByYb\r\n         B63GnUDCKwR91WxpEYxAP2yFMab/WZJLRTDYR02I1JZYnZ4ne7VMh8aNWRzswoVsLp70\r\n         DdZg==\r\nX-Gm-Message-State: AElRT7FgXRmMIHd8gb6fR/eYLVrv/mZ+UtEcKIOw5gXyxVJjeMDTI9M1\r\n\t1S3R/qxrK5tNBwEjT2ytXOcAHjmbLItW30pGVXUuyA==\r\nX-Google-Smtp-Source: AG47ELtqmWDQOyF0c5WJKV3mjXc9lYA7hQlLDRtR+bbflTESlj9V4nt4X8v1EnqL2HEWY3jU8SzsRu6xLamTjSKCbAM=\r\nX-Received: by 10.31.199.6 with SMTP id x6mr1931862vkf.6.1520985125067; Tue,\r\n 13 Mar 2018 16:52:05 -0700 (PDT)\r\nMIME-Version: 1.0\r\nReceived: by 10.31.10.8 with HTTP; Tue, 13 Mar 2018 16:52:04 -0700 (PDT)\r\nFrom: Louis Barclay <louis.barclay@gmail.com>\r\nDate: Tue, 13 Mar 2018 23:52:04 +0000\r\nMessage-ID: <CAL2-1RZtV1dbz+ZdaMh+kndHmqHWpvotFHeUKp8g4n4v1Gtz6g@mail.gmail.com>\r\nSubject: asdfafd\r\nTo: Louis Barclay <louis@sundaystori.es>\r\nContent-Type: multipart/alternative; boundary=\"001a114dddf016a5ab056753f279\"\r\n\r\n--001a114dddf016a5ab056753f279\r\nContent-Type: text/plain; charset=\"UTF-8\"\r\n\r\nasdfasdf\r\n\r\n--001a114dddf016a5ab056753f279\r\nContent-Type: text/html; charset=\"UTF-8\"\r\n\r\n<div dir=\"ltr\"><div class=\"gmail_default\" style=\"font-family:tahoma,sans-serif;font-size:small\">asdfasdf</div></div>\r\n\r\n--001a114dddf016a5ab056753f279--\r\n"}