{
  "html":
    "<div dir=\"ltr\"><div class=\"gmail_default\" style=\"font-family:tahoma,sans-serif;font-size:small\">yeah</div></div>\n",
  "text": "yeah\n",
  "headers": {
    "delivered-to": "louis@sundaystori.es",
    "received": [
      "by 10.236.141.129 with SMTP id d1csp697814pjo; Fri, 23 Feb 2018 05:18:32 -0800 (PST)",
      "from mail-sor-f41.google.com (mail-sor-f41.google.com. [209.85.220.41]) by mx.google.com with SMTPS id t12sor994117vkc.95.2018.02.23.05.18.32 for <louis@sundaystori.es> (Google Transport Security); Fri, 23 Feb 2018 05:18:32 -0800 (PST)",
      "by 10.31.10.8 with HTTP; Fri, 23 Feb 2018 05:18:30 -0800 (PST)"
    ],
    "x-received": [
      "by 10.176.68.35 with SMTP id m32mr1182144uam.5.1519391912324; Fri, 23 Feb 2018 05:18:32 -0800 (PST)",
      "by 10.31.138.72 with SMTP id m69mr1088017vkd.13.1519391911614; Fri, 23 Feb 2018 05:18:31 -0800 (PST)"
    ],
    "arc-seal":
      "i=1; a=rsa-sha256; t=1519391912; cv=none; d=google.com; s=arc-20160816; b=W2vFCfDyXTvWXZMpoCG3ys6MairuUrxcjhYhg4zlES32UFli24ahpzejM0yleGFQ5h x4cbQl2uc3xkiATUtkPvIPI2nkY7rtRil6OzmlJ1OYPsah35bpr2wd4xX1kdejngsL2Q 1JmLi/NeuW4n5GV8CqkY/fc2xSrtKOAloQb379S0wdAWLqAvFHTuXUpyCNRP6GPfTazV 3ZmWasWKGYKfcQ+BRTdlSAeoAN+DT4eLSkxpcYqDJfGE5fNEwo3JmgM4tk/pmaq8poY0 W4NZ9jVEgQnWIls0llq7CR2PW7sW1jzzObRB71w2K8OjkcltDyvGO7SIkWZ8YUlXu01E jnXg==",
    "arc-message-signature":
      "i=1; a=rsa-sha256; c=relaxed/relaxed; d=google.com; s=arc-20160816; h=to:subject:message-id:date:from:mime-version:dkim-signature :arc-authentication-results; bh=uD2Wfg2P4CBVmxMFUkiDKn2IczZj+Qb4nGT7hDFKy/g=; b=vvajtP2rJGQsDKrwCUFmDMONzdejSkFRjO3IBW7EfQL/DPPkC8sizflyjDNWtqmXX0 bNIqWtbqydReoEsiM1Axs0W26JyPTUqj048caL0Bc+bI9a8eJm0hbb2+/uOF0sJ/0Azn PrG3NRrZPyQvqOtZQ9JTFtfl0iaWXAqhMgvhzj1QttBmpu6lE6X44KhTCTz/XILI1Qs8 88v47pfcRH0L6aNcyyOCIqvC0tYltB0e1B+9Ls7p0IgLTg1IPYmwGZlIgChlkgf0usCo YhYeKOApbCOPsbUk3AzDIg414OdsiP4P7dHKsmiMmPSAmFPPf9/U+qISqJmSTZ/NsvpI u9LQ==",
    "arc-authentication-results":
      "i=1; mx.google.com; dkim=pass header.i=@gmail.com header.s=20161025 header.b=Y52Vkl2J; spf=pass (google.com: domain of louis.barclay@gmail.com designates 209.85.220.41 as permitted sender) smtp.mailfrom=louis.barclay@gmail.com; dmarc=pass (p=NONE sp=QUARANTINE dis=NONE) header.from=gmail.com",
    "return-path": "<louis.barclay@gmail.com>",
    "received-spf":
      "pass (google.com: domain of louis.barclay@gmail.com designates 209.85.220.41 as permitted sender) client-ip=209.85.220.41;",
    "authentication-results":
      "mx.google.com; dkim=pass header.i=@gmail.com header.s=20161025 header.b=Y52Vkl2J; spf=pass (google.com: domain of louis.barclay@gmail.com designates 209.85.220.41 as permitted sender) smtp.mailfrom=louis.barclay@gmail.com; dmarc=pass (p=NONE sp=QUARANTINE dis=NONE) header.from=gmail.com",
    "dkim-signature":
      "v=1; a=rsa-sha256; c=relaxed/relaxed; d=gmail.com; s=20161025; h=mime-version:from:date:message-id:subject:to; bh=uD2Wfg2P4CBVmxMFUkiDKn2IczZj+Qb4nGT7hDFKy/g=; b=Y52Vkl2J6Kp1w05s5vzLKp4WDHqShvKemGmruu006HTPN92gzvg9Qee84vMd8sgmy7 bQ6FPjFDU/vdXWWCTBuXpBozpd3owoo6ydAdwTXjfG9xcRAhHJPVIGzli3O7i45aIOpF vigk55TXwigszVWxAcEnR9mKZyVeMiKGVwcmE6cPFRjo+s1h9lNSbrIjYEZZBWGQxxPD YlbILZncd/UpxJzdP+Gx/hnQ19DmvFLsY+P+J2F3JRISpid8NZM4bNrxx8/nqwfmLMnZ cjVaRXyunat20R5Sy4IxrEJ1h33pMwv11XGYkk8YZx25DWCvyCQAEvep7ur80BY++Qq9 8Yow==",
    "x-google-dkim-signature":
      "v=1; a=rsa-sha256; c=relaxed/relaxed; d=1e100.net; s=20161025; h=x-gm-message-state:mime-version:from:date:message-id:subject:to; bh=uD2Wfg2P4CBVmxMFUkiDKn2IczZj+Qb4nGT7hDFKy/g=; b=EONqXK6kkiB75D1ukwKS1fmfYtRuH7momKOoOpbnGwiqCRqx/MxVOsFqr7R3DpYRvE HifGidY/dxbeQNNU+TCEWrc7rW2niAsm69ESvZ9XnYfm7BOkfcoLowXqIEWe9yAzdf+M HpPXC/lJ8ak/yoPeR5TSC1Skf38J/qz632inusiwrvEgclIl3jpBiRfx74RPtNbcvC8g 3AIxCLF8V4bTrsOx2v/IArO0LZfxq1zPR+87bfU4knmLAQghhrJb0wRsn6pme4iR+3Bt Y1F49VcijWuWuF9SgbrqImNV0CMttWQD+f/jLRDOYaBMXkFcoxK1MCeAxRsZMbxSmW4j p6uQ==",
    "x-gm-message-state":
      "APf1xPDH2gtCh5c7/v8E+lEtf+TgafPaHEQmfxUz+qJZUGnNR+j3eiHM qm9DiOGzs6tn82XvcTnKlOLWZ4epYOZ0RY8cH0/Jxw==",
    "x-google-smtp-source":
      "AG47ELtd2WdKoSowdnaBGCPUfAr67EVmh72E2wxmJuMcyloc8v+kd7r5K4IvePo/ytW0IGay8AYpMWHtQq/WVh3tqxE=",
    "mime-version": "1.0",
    "from": "Louis Barclay <louis.barclay@gmail.com>",
    "date": "Fri, 23 Feb 2018 13:18:30 +0000",
    "message-id": "<CAL2-1RbPa-m0Z1jM46e_acmTDQmeNniYPM=qq3=yHyQerMgv7w@mail.gmail.com>",
    "subject": "see_it_appear",
    "to": "Louis Barclay <louis@sundaystori.es>",
    "content-type": "multipart/alternative; boundary=\"001a114563222a9ea70565e0ff16\""
  },
  "subject": "see_it_appear",
  "messageId": "CAL2-1RbPa-m0Z1jM46e_acmTDQmeNniYPM=qq3=yHyQerMgv7w@mail.gmail.com",
  "priority": "normal",
  "from": [{ "address": "louis.barclay@gmail.com", "name": "Louis Barclay" }],
  "to": [{ "address": "louis@sundaystori.es", "name": "Louis Barclay" }],
  "date": "2018-02-23T13:18:30.000Z",
  "receivedDate": "2018-02-23T13:18:32.000Z",
  "eml":
    "Delivered-To: louis@sundaystori.es\r\nReceived: by 10.236.141.129 with SMTP id d1csp697814pjo;\r\n        Fri, 23 Feb 2018 05:18:32 -0800 (PST)\r\nX-Received: by 10.176.68.35 with SMTP id m32mr1182144uam.5.1519391912324;\r\n        Fri, 23 Feb 2018 05:18:32 -0800 (PST)\r\nARC-Seal: i=1; a=rsa-sha256; t=1519391912; cv=none;\r\n        d=google.com; s=arc-20160816;\r\n        b=W2vFCfDyXTvWXZMpoCG3ys6MairuUrxcjhYhg4zlES32UFli24ahpzejM0yleGFQ5h\r\n         x4cbQl2uc3xkiATUtkPvIPI2nkY7rtRil6OzmlJ1OYPsah35bpr2wd4xX1kdejngsL2Q\r\n         1JmLi/NeuW4n5GV8CqkY/fc2xSrtKOAloQb379S0wdAWLqAvFHTuXUpyCNRP6GPfTazV\r\n         3ZmWasWKGYKfcQ+BRTdlSAeoAN+DT4eLSkxpcYqDJfGE5fNEwo3JmgM4tk/pmaq8poY0\r\n         W4NZ9jVEgQnWIls0llq7CR2PW7sW1jzzObRB71w2K8OjkcltDyvGO7SIkWZ8YUlXu01E\r\n         jnXg==\r\nARC-Message-Signature: i=1; a=rsa-sha256; c=relaxed/relaxed; d=google.com; s=arc-20160816;\r\n        h=to:subject:message-id:date:from:mime-version:dkim-signature\r\n         :arc-authentication-results;\r\n        bh=uD2Wfg2P4CBVmxMFUkiDKn2IczZj+Qb4nGT7hDFKy/g=;\r\n        b=vvajtP2rJGQsDKrwCUFmDMONzdejSkFRjO3IBW7EfQL/DPPkC8sizflyjDNWtqmXX0\r\n         bNIqWtbqydReoEsiM1Axs0W26JyPTUqj048caL0Bc+bI9a8eJm0hbb2+/uOF0sJ/0Azn\r\n         PrG3NRrZPyQvqOtZQ9JTFtfl0iaWXAqhMgvhzj1QttBmpu6lE6X44KhTCTz/XILI1Qs8\r\n         88v47pfcRH0L6aNcyyOCIqvC0tYltB0e1B+9Ls7p0IgLTg1IPYmwGZlIgChlkgf0usCo\r\n         YhYeKOApbCOPsbUk3AzDIg414OdsiP4P7dHKsmiMmPSAmFPPf9/U+qISqJmSTZ/NsvpI\r\n         u9LQ==\r\nARC-Authentication-Results: i=1; mx.google.com;\r\n       dkim=pass header.i=@gmail.com header.s=20161025 header.b=Y52Vkl2J;\r\n       spf=pass (google.com: domain of louis.barclay@gmail.com designates 209.85.220.41 as permitted sender) smtp.mailfrom=louis.barclay@gmail.com;\r\n       dmarc=pass (p=NONE sp=QUARANTINE dis=NONE) header.from=gmail.com\r\nReturn-Path: <louis.barclay@gmail.com>\r\nReceived: from mail-sor-f41.google.com (mail-sor-f41.google.com. [209.85.220.41])\r\n        by mx.google.com with SMTPS id t12sor994117vkc.95.2018.02.23.05.18.32\r\n        for <louis@sundaystori.es>\r\n        (Google Transport Security);\r\n        Fri, 23 Feb 2018 05:18:32 -0800 (PST)\r\nReceived-SPF: pass (google.com: domain of louis.barclay@gmail.com designates 209.85.220.41 as permitted sender) client-ip=209.85.220.41;\r\nAuthentication-Results: mx.google.com;\r\n       dkim=pass header.i=@gmail.com header.s=20161025 header.b=Y52Vkl2J;\r\n       spf=pass (google.com: domain of louis.barclay@gmail.com designates 209.85.220.41 as permitted sender) smtp.mailfrom=louis.barclay@gmail.com;\r\n       dmarc=pass (p=NONE sp=QUARANTINE dis=NONE) header.from=gmail.com\r\nDKIM-Signature: v=1; a=rsa-sha256; c=relaxed/relaxed;\r\n        d=gmail.com; s=20161025;\r\n        h=mime-version:from:date:message-id:subject:to;\r\n        bh=uD2Wfg2P4CBVmxMFUkiDKn2IczZj+Qb4nGT7hDFKy/g=;\r\n        b=Y52Vkl2J6Kp1w05s5vzLKp4WDHqShvKemGmruu006HTPN92gzvg9Qee84vMd8sgmy7\r\n         bQ6FPjFDU/vdXWWCTBuXpBozpd3owoo6ydAdwTXjfG9xcRAhHJPVIGzli3O7i45aIOpF\r\n         vigk55TXwigszVWxAcEnR9mKZyVeMiKGVwcmE6cPFRjo+s1h9lNSbrIjYEZZBWGQxxPD\r\n         YlbILZncd/UpxJzdP+Gx/hnQ19DmvFLsY+P+J2F3JRISpid8NZM4bNrxx8/nqwfmLMnZ\r\n         cjVaRXyunat20R5Sy4IxrEJ1h33pMwv11XGYkk8YZx25DWCvyCQAEvep7ur80BY++Qq9\r\n         8Yow==\r\nX-Google-DKIM-Signature: v=1; a=rsa-sha256; c=relaxed/relaxed;\r\n        d=1e100.net; s=20161025;\r\n        h=x-gm-message-state:mime-version:from:date:message-id:subject:to;\r\n        bh=uD2Wfg2P4CBVmxMFUkiDKn2IczZj+Qb4nGT7hDFKy/g=;\r\n        b=EONqXK6kkiB75D1ukwKS1fmfYtRuH7momKOoOpbnGwiqCRqx/MxVOsFqr7R3DpYRvE\r\n         HifGidY/dxbeQNNU+TCEWrc7rW2niAsm69ESvZ9XnYfm7BOkfcoLowXqIEWe9yAzdf+M\r\n         HpPXC/lJ8ak/yoPeR5TSC1Skf38J/qz632inusiwrvEgclIl3jpBiRfx74RPtNbcvC8g\r\n         3AIxCLF8V4bTrsOx2v/IArO0LZfxq1zPR+87bfU4knmLAQghhrJb0wRsn6pme4iR+3Bt\r\n         Y1F49VcijWuWuF9SgbrqImNV0CMttWQD+f/jLRDOYaBMXkFcoxK1MCeAxRsZMbxSmW4j\r\n         p6uQ==\r\nX-Gm-Message-State: APf1xPDH2gtCh5c7/v8E+lEtf+TgafPaHEQmfxUz+qJZUGnNR+j3eiHM\r\n\tqm9DiOGzs6tn82XvcTnKlOLWZ4epYOZ0RY8cH0/Jxw==\r\nX-Google-Smtp-Source: AG47ELtd2WdKoSowdnaBGCPUfAr67EVmh72E2wxmJuMcyloc8v+kd7r5K4IvePo/ytW0IGay8AYpMWHtQq/WVh3tqxE=\r\nX-Received: by 10.31.138.72 with SMTP id m69mr1088017vkd.13.1519391911614;\r\n Fri, 23 Feb 2018 05:18:31 -0800 (PST)\r\nMIME-Version: 1.0\r\nReceived: by 10.31.10.8 with HTTP; Fri, 23 Feb 2018 05:18:30 -0800 (PST)\r\nFrom: Louis Barclay <louis.barclay@gmail.com>\r\nDate: Fri, 23 Feb 2018 13:18:30 +0000\r\nMessage-ID: <CAL2-1RbPa-m0Z1jM46e_acmTDQmeNniYPM=qq3=yHyQerMgv7w@mail.gmail.com>\r\nSubject: see_it_appear\r\nTo: Louis Barclay <louis@sundaystori.es>\r\nContent-Type: multipart/alternative; boundary=\"001a114563222a9ea70565e0ff16\"\r\n\r\n--001a114563222a9ea70565e0ff16\r\nContent-Type: text/plain; charset=\"UTF-8\"\r\n\r\nyeah\r\n\r\n--001a114563222a9ea70565e0ff16\r\nContent-Type: text/html; charset=\"UTF-8\"\r\n\r\n<div dir=\"ltr\"><div class=\"gmail_default\" style=\"font-family:tahoma,sans-serif;font-size:small\">yeah</div></div>\r\n\r\n--001a114563222a9ea70565e0ff16--\r\n"
}
