{"html":"<div dir=\"ltr\"><div class=\"gmail_default\" style=\"font-family:tahoma,sans-serif;font-size:small\">Hello good sir, I wish to sign up</div></div>\n","text":"Hello good sir, I wish to sign up\n","headers":{"delivered-to":"louis@sundaystori.es","received":["by 10.236.140.137 with SMTP id b9csp2201447pjo; Sun, 18 Mar 2018 20:21:48 -0700 (PDT)","from mail-sor-f41.google.com (mail-sor-f41.google.com. [209.85.220.41]) by mx.google.com with SMTPS id d6sor4784855uai.24.2018.03.18.20.21.48 for <louis@sundaystori.es> (Google Transport Security); Sun, 18 Mar 2018 20:21:48 -0700 (PDT)","by 10.31.161.20 with HTTP; Sun, 18 Mar 2018 20:21:47 -0700 (PDT)"],"x-received":["by 10.176.22.82 with SMTP id l18mr7233122uae.126.1521429708920; Sun, 18 Mar 2018 20:21:48 -0700 (PDT)","by 10.176.6.197 with SMTP id g63mr6929111uag.72.1521429708281; Sun, 18 Mar 2018 20:21:48 -0700 (PDT)"],"arc-seal":"i=1; a=rsa-sha256; t=1521429708; cv=none; d=google.com; s=arc-20160816; b=Pq4G3TI5+48mbsMcM56B0tbTxAfp4fh7MVqzEg+mR+oqmS2Istmj80NZNNnofKJI9z mxDp/Lv5qxEiJS5RYr5OgUjwpCYbyaqE13PtBYbmiek7QPH+x7Z55dmGMxAMfbwSiiUe UkcNxrd5px6SRK+VSywdMvsxlhtBKyHLX9bxwMtxpycXNtG5FdzIVBv3jAvmxZEEyrmZ K3AVMTF7yTPcl/H5eumuxwO9RpJ5cPsj7YZ3ht+B3cBovXxUp2dmaHuZtpVMz3i+yHC1 zKgSxY81dtvEdpwJ3OdSk/9ibY8sBUNGgmlcuhg9IDKl3J7nuNFlyTku/R3F9sks83ZB WI0A==","arc-message-signature":"i=1; a=rsa-sha256; c=relaxed/relaxed; d=google.com; s=arc-20160816; h=to:subject:message-id:date:from:mime-version:dkim-signature :arc-authentication-results; bh=bVM5gR7ERkbWe4/iIGGi7ek0DXBdcNuEhpGE3fJylAY=; b=00C0xq6bNb5o1yvKD9MZQbMbkpU2yge0x65cusCyqJa8LsvZm0DSfr0lWonnrNR9yz RcZz6l8B17tvTWnrYXlEWFUgOqdT3pAaG7I7/hdetKDalXK87bJDsbQYPXb3UIu5YM4M rjHc+RLWcFhs6qBwl7uFJVqSoSDGfm7R8p4kRozsmfQB2SAjGHDpKk2lHDc5Ypl0QslC RwgMgJb5Tm7sBKdeNLfi1CITKhpmAry+ONd5nvmKs9XVWbKTZe59kXxLZ1uKbzsawbZ1 cX7x/r9TC0sfa9LqTpyHKKPCe/dUEOYjYdsyvXGP+AKVq5ZjXCZIHwx3D47D8YWGARZo DqQQ==","arc-authentication-results":"i=1; mx.google.com; dkim=pass header.i=@gmail.com header.s=20161025 header.b=m/F9Ebxt; spf=pass (google.com: domain of louis.barclay@gmail.com designates 209.85.220.41 as permitted sender) smtp.mailfrom=louis.barclay@gmail.com; dmarc=pass (p=NONE sp=QUARANTINE dis=NONE) header.from=gmail.com","return-path":"<louis.barclay@gmail.com>","received-spf":"pass (google.com: domain of louis.barclay@gmail.com designates 209.85.220.41 as permitted sender) client-ip=209.85.220.41;","authentication-results":"mx.google.com; dkim=pass header.i=@gmail.com header.s=20161025 header.b=m/F9Ebxt; spf=pass (google.com: domain of louis.barclay@gmail.com designates 209.85.220.41 as permitted sender) smtp.mailfrom=louis.barclay@gmail.com; dmarc=pass (p=NONE sp=QUARANTINE dis=NONE) header.from=gmail.com","dkim-signature":"v=1; a=rsa-sha256; c=relaxed/relaxed; d=gmail.com; s=20161025; h=mime-version:from:date:message-id:subject:to; bh=bVM5gR7ERkbWe4/iIGGi7ek0DXBdcNuEhpGE3fJylAY=; b=m/F9EbxtKV6OEOj1/bUynJ9BOunreS+FxsSXmHxnCjY5sk2GjYW3tSVBO/URbdwBqU upgrNSrgsxdBfdSJfoZqGtsJ8Z9iLfzXhzHslswSPPPontVNsufT1TfU2z8OhnsMBacY +szryUdpzTYBY/FDdWf8QNr9CJp33LYeOyu6kO+icKW5cbgUDXM2HoPZ5QnxpZ3WXtEy HGAe0zjoAJ728yjRfCfeVS93OPp7sbn3mp0l8WbPXZIYo2sjPFd5dFgZGkRDT9h4naL/ rXB8s026wKTDgB1TfFv++NHw4MPYiT9pHf4sXch+/3WAmx1h0niyADsE76geRbfLlzED eANg==","x-google-dkim-signature":"v=1; a=rsa-sha256; c=relaxed/relaxed; d=1e100.net; s=20161025; h=x-gm-message-state:mime-version:from:date:message-id:subject:to; bh=bVM5gR7ERkbWe4/iIGGi7ek0DXBdcNuEhpGE3fJylAY=; b=X+KpUCxy0UtD4YiA9i7U6e3Tln65HFTznhK05YL4GkT8ak18OyrdsfwzRQ2HpGpTcg OXGU4F3g6SkQnWDu/YJ30gPFO5I0b8ikP41qGy7yH0c7moSDv/KM48P1Hq18JI61DmXV eInGCKz96TDPsFagSr4wTuY+SeL6Mkg5bRE1mdHt7QGNl0+TetmuWnlHNoHYIHxErvLm pWJVr3j/GQBkuxYDHyGFmXodfyb2w7XeUvo0cWgBZRXVpSAAZX3XHRlt3iBo9Tme2lf2 jCdaKdHR5LzkJMFpBhusTsO5Lr0jUb6wmK/ydjfLrLEtP1Dzb6Vp4fbXCtKU4dM9CfbO yANw==","x-gm-message-state":"AElRT7GRs8pHN5sI36/AD5wiFm2+U2e3qFXTXhYfWw7S9HDOntum3Mrx i0QowyWNItvInfnTfU1jLYXTpGvHMk8ARbso8riysw==","x-google-smtp-source":"AG47ELs2A0s4lB4HPAMWazVjpVAm4yrNhgDiYYMM3OeaxGVCsKyfLtyZn+x0bFcHVrJqp1jrBaOJnOVEfM4TjwiKgq8=","mime-version":"1.0","from":"Louis Barclay <louis.barclay@gmail.com>","date":"Mon, 19 Mar 2018 03:21:47 +0000","message-id":"<CAL2-1Rb3cuJVL_DV_WUCUJoQHBx0Atmg_dxSF6ceFcvr46=X7g@mail.gmail.com>","subject":"1_initial_email","to":"Louis Barclay <louis@sundaystori.es>","content-type":"multipart/alternative; boundary=\"94eb2c122e64501d680567bb7593\""},"subject":"1_initial_email","messageId":"CAL2-1Rb3cuJVL_DV_WUCUJoQHBx0Atmg_dxSF6ceFcvr46=X7g@mail.gmail.com","priority":"normal","from":[{"address":"louis.barclay@gmail.com","name":"Louis Barclay"}],"to":[{"address":"louis@sundaystori.es","name":"Louis Barclay"}],"date":"2018-03-19T03:21:47.000Z","receivedDate":"2018-03-19T03:21:48.000Z","eml":"Delivered-To: louis@sundaystori.es\r\nReceived: by 10.236.140.137 with SMTP id b9csp2201447pjo;\r\n        Sun, 18 Mar 2018 20:21:48 -0700 (PDT)\r\nX-Received: by 10.176.22.82 with SMTP id l18mr7233122uae.126.1521429708920;\r\n        Sun, 18 Mar 2018 20:21:48 -0700 (PDT)\r\nARC-Seal: i=1; a=rsa-sha256; t=1521429708; cv=none;\r\n        d=google.com; s=arc-20160816;\r\n        b=Pq4G3TI5+48mbsMcM56B0tbTxAfp4fh7MVqzEg+mR+oqmS2Istmj80NZNNnofKJI9z\r\n         mxDp/Lv5qxEiJS5RYr5OgUjwpCYbyaqE13PtBYbmiek7QPH+x7Z55dmGMxAMfbwSiiUe\r\n         UkcNxrd5px6SRK+VSywdMvsxlhtBKyHLX9bxwMtxpycXNtG5FdzIVBv3jAvmxZEEyrmZ\r\n         K3AVMTF7yTPcl/H5eumuxwO9RpJ5cPsj7YZ3ht+B3cBovXxUp2dmaHuZtpVMz3i+yHC1\r\n         zKgSxY81dtvEdpwJ3OdSk/9ibY8sBUNGgmlcuhg9IDKl3J7nuNFlyTku/R3F9sks83ZB\r\n         WI0A==\r\nARC-Message-Signature: i=1; a=rsa-sha256; c=relaxed/relaxed; d=google.com; s=arc-20160816;\r\n        h=to:subject:message-id:date:from:mime-version:dkim-signature\r\n         :arc-authentication-results;\r\n        bh=bVM5gR7ERkbWe4/iIGGi7ek0DXBdcNuEhpGE3fJylAY=;\r\n        b=00C0xq6bNb5o1yvKD9MZQbMbkpU2yge0x65cusCyqJa8LsvZm0DSfr0lWonnrNR9yz\r\n         RcZz6l8B17tvTWnrYXlEWFUgOqdT3pAaG7I7/hdetKDalXK87bJDsbQYPXb3UIu5YM4M\r\n         rjHc+RLWcFhs6qBwl7uFJVqSoSDGfm7R8p4kRozsmfQB2SAjGHDpKk2lHDc5Ypl0QslC\r\n         RwgMgJb5Tm7sBKdeNLfi1CITKhpmAry+ONd5nvmKs9XVWbKTZe59kXxLZ1uKbzsawbZ1\r\n         cX7x/r9TC0sfa9LqTpyHKKPCe/dUEOYjYdsyvXGP+AKVq5ZjXCZIHwx3D47D8YWGARZo\r\n         DqQQ==\r\nARC-Authentication-Results: i=1; mx.google.com;\r\n       dkim=pass header.i=@gmail.com header.s=20161025 header.b=m/F9Ebxt;\r\n       spf=pass (google.com: domain of louis.barclay@gmail.com designates 209.85.220.41 as permitted sender) smtp.mailfrom=louis.barclay@gmail.com;\r\n       dmarc=pass (p=NONE sp=QUARANTINE dis=NONE) header.from=gmail.com\r\nReturn-Path: <louis.barclay@gmail.com>\r\nReceived: from mail-sor-f41.google.com (mail-sor-f41.google.com. [209.85.220.41])\r\n        by mx.google.com with SMTPS id d6sor4784855uai.24.2018.03.18.20.21.48\r\n        for <louis@sundaystori.es>\r\n        (Google Transport Security);\r\n        Sun, 18 Mar 2018 20:21:48 -0700 (PDT)\r\nReceived-SPF: pass (google.com: domain of louis.barclay@gmail.com designates 209.85.220.41 as permitted sender) client-ip=209.85.220.41;\r\nAuthentication-Results: mx.google.com;\r\n       dkim=pass header.i=@gmail.com header.s=20161025 header.b=m/F9Ebxt;\r\n       spf=pass (google.com: domain of louis.barclay@gmail.com designates 209.85.220.41 as permitted sender) smtp.mailfrom=louis.barclay@gmail.com;\r\n       dmarc=pass (p=NONE sp=QUARANTINE dis=NONE) header.from=gmail.com\r\nDKIM-Signature: v=1; a=rsa-sha256; c=relaxed/relaxed;\r\n        d=gmail.com; s=20161025;\r\n        h=mime-version:from:date:message-id:subject:to;\r\n        bh=bVM5gR7ERkbWe4/iIGGi7ek0DXBdcNuEhpGE3fJylAY=;\r\n        b=m/F9EbxtKV6OEOj1/bUynJ9BOunreS+FxsSXmHxnCjY5sk2GjYW3tSVBO/URbdwBqU\r\n         upgrNSrgsxdBfdSJfoZqGtsJ8Z9iLfzXhzHslswSPPPontVNsufT1TfU2z8OhnsMBacY\r\n         +szryUdpzTYBY/FDdWf8QNr9CJp33LYeOyu6kO+icKW5cbgUDXM2HoPZ5QnxpZ3WXtEy\r\n         HGAe0zjoAJ728yjRfCfeVS93OPp7sbn3mp0l8WbPXZIYo2sjPFd5dFgZGkRDT9h4naL/\r\n         rXB8s026wKTDgB1TfFv++NHw4MPYiT9pHf4sXch+/3WAmx1h0niyADsE76geRbfLlzED\r\n         eANg==\r\nX-Google-DKIM-Signature: v=1; a=rsa-sha256; c=relaxed/relaxed;\r\n        d=1e100.net; s=20161025;\r\n        h=x-gm-message-state:mime-version:from:date:message-id:subject:to;\r\n        bh=bVM5gR7ERkbWe4/iIGGi7ek0DXBdcNuEhpGE3fJylAY=;\r\n        b=X+KpUCxy0UtD4YiA9i7U6e3Tln65HFTznhK05YL4GkT8ak18OyrdsfwzRQ2HpGpTcg\r\n         OXGU4F3g6SkQnWDu/YJ30gPFO5I0b8ikP41qGy7yH0c7moSDv/KM48P1Hq18JI61DmXV\r\n         eInGCKz96TDPsFagSr4wTuY+SeL6Mkg5bRE1mdHt7QGNl0+TetmuWnlHNoHYIHxErvLm\r\n         pWJVr3j/GQBkuxYDHyGFmXodfyb2w7XeUvo0cWgBZRXVpSAAZX3XHRlt3iBo9Tme2lf2\r\n         jCdaKdHR5LzkJMFpBhusTsO5Lr0jUb6wmK/ydjfLrLEtP1Dzb6Vp4fbXCtKU4dM9CfbO\r\n         yANw==\r\nX-Gm-Message-State: AElRT7GRs8pHN5sI36/AD5wiFm2+U2e3qFXTXhYfWw7S9HDOntum3Mrx\r\n\ti0QowyWNItvInfnTfU1jLYXTpGvHMk8ARbso8riysw==\r\nX-Google-Smtp-Source: AG47ELs2A0s4lB4HPAMWazVjpVAm4yrNhgDiYYMM3OeaxGVCsKyfLtyZn+x0bFcHVrJqp1jrBaOJnOVEfM4TjwiKgq8=\r\nX-Received: by 10.176.6.197 with SMTP id g63mr6929111uag.72.1521429708281;\r\n Sun, 18 Mar 2018 20:21:48 -0700 (PDT)\r\nMIME-Version: 1.0\r\nReceived: by 10.31.161.20 with HTTP; Sun, 18 Mar 2018 20:21:47 -0700 (PDT)\r\nFrom: Louis Barclay <louis.barclay@gmail.com>\r\nDate: Mon, 19 Mar 2018 03:21:47 +0000\r\nMessage-ID: <CAL2-1Rb3cuJVL_DV_WUCUJoQHBx0Atmg_dxSF6ceFcvr46=X7g@mail.gmail.com>\r\nSubject: 1_initial_email\r\nTo: Louis Barclay <louis@sundaystori.es>\r\nContent-Type: multipart/alternative; boundary=\"94eb2c122e64501d680567bb7593\"\r\n\r\n--94eb2c122e64501d680567bb7593\r\nContent-Type: text/plain; charset=\"UTF-8\"\r\n\r\nHello good sir, I wish to sign up\r\n\r\n--94eb2c122e64501d680567bb7593\r\nContent-Type: text/html; charset=\"UTF-8\"\r\n\r\n<div dir=\"ltr\"><div class=\"gmail_default\" style=\"font-family:tahoma,sans-serif;font-size:small\">Hello good sir, I wish to sign up</div></div>\r\n\r\n--94eb2c122e64501d680567bb7593--\r\n"}