{"html":"<div dir=\"ltr\"><div class=\"gmail_default\" style=\"font-family:tahoma,sans-serif;font-size:small\">REMOVEREADER <a href=\"mailto:louis.barclay%2Bfifth@gmail.com\">louis.barclay+fifth@gmail.com</a></div></div>\n","text":"REMOVEWRITER louis.barclay@gmail.com\n","headers":{"delivered-to":"louis@sundaystori.es","received":["by 10.100.153.134 with SMTP id 6csp2630911pji; Mon, 2 Apr 2018 07:54:55 -0700 (PDT)","from mail-sor-f41.google.com (mail-sor-f41.google.com. [209.85.220.41]) by mx.google.com with SMTPS id d7sor170046uaj.183.2018.04.02.07.54.55 for <louis@sundaystori.es> (Google Transport Security); Mon, 02 Apr 2018 07:54:55 -0700 (PDT)","by 10.31.161.151 with HTTP; Mon, 2 Apr 2018 07:54:54 -0700 (PDT)"],"x-received":["by 10.176.13.134 with SMTP id i6mr2968260uak.177.1522680895773; Mon, 02 Apr 2018 07:54:55 -0700 (PDT)","by 10.159.32.72 with SMTP id 66mr5716214uam.72.1522680895148; Mon, 02 Apr 2018 07:54:55 -0700 (PDT)"],"arc-seal":"i=1; a=rsa-sha256; t=1522680895; cv=none; d=google.com; s=arc-20160816; b=ofM5s5T0sYJ3E7rLYq14XgkHKjjScSY0A+Q7fr6pnFLHGBUMzMzY7KDdZfYzPkXUoJ tjAip7HX3ZXeYxCqjp98+vWvwcJ4MhUxtTYFPjAESWkZYPps1OrnoJ3k7Yur4q1yEN99 Od5as75tdsR/6+/ooj++/eUk2f1qstMHrV5dWH9x7EhaxWTN6f4x+erOQF0xFiQC74sy vAnO2GzuqECoCFKOqnaiu/LnJdvyxTJcJRtFE1digR/50XkQ2qVfaZWYXEcKbivNv2v+ 35vDH+PZrDIVjw1zwcEiSuLd5JSl+IqyKdNFOlEZbVCDXu8UetqzjdJY/ADC5xvSKQLM +Zqw==","arc-message-signature":"i=1; a=rsa-sha256; c=relaxed/relaxed; d=google.com; s=arc-20160816; h=to:subject:message-id:date:from:mime-version:dkim-signature :arc-authentication-results; bh=WNwtvK5+Ps6kgo1xd29wyUW3Jb/06thZdgTXRNuTVXU=; b=BTnR23CYzIb5FZTFxWciuoNh738UaE5QebIujNLaunTk+Cp8kxKX7ioOxJJ5qUUZ4h qoIYSd8gBtWwlIslVe0XrXHBca2I3f96YzGH43y65mtmTrDzfqWgD759dKXIgl2JnlCw VKvnNAWNSjGALPuGP8u+SrEA0IY7poIxaMR2/cKmoospccN4GGsN5YmDugzmN0OPrZdC AHsUNxIdMv/ssVYd6ZMadgadqnwB440yMPvBeIw1U5O1RKjJ8GkwB68KHOM481ywG/Y0 mql5gH5k414soCgbLplFbss6EGfrwKMMAV3vscaUyVzU7b5/jDPejc73jtVGUcwpB80a ZSyA==","arc-authentication-results":"i=1; mx.google.com; dkim=pass header.i=@gmail.com header.s=20161025 header.b=QU6jb9SL; spf=pass (google.com: domain of louis.barclay+fred@gmail.com designates 209.85.220.41 as permitted sender) smtp.mailfrom=louis.barclay+fred@gmail.com; dmarc=pass (p=NONE sp=QUARANTINE dis=NONE) header.from=gmail.com","return-path":"<louis.barclay+fred@gmail.com>","received-spf":"pass (google.com: domain of louis.barclay+fred@gmail.com designates 209.85.220.41 as permitted sender) client-ip=209.85.220.41;","authentication-results":"mx.google.com; dkim=pass header.i=@gmail.com header.s=20161025 header.b=QU6jb9SL; spf=pass (google.com: domain of louis.barclay+fred@gmail.com designates 209.85.220.41 as permitted sender) smtp.mailfrom=louis.barclay+fred@gmail.com; dmarc=pass (p=NONE sp=QUARANTINE dis=NONE) header.from=gmail.com","dkim-signature":"v=1; a=rsa-sha256; c=relaxed/relaxed; d=gmail.com; s=20161025; h=mime-version:from:date:message-id:subject:to; bh=WNwtvK5+Ps6kgo1xd29wyUW3Jb/06thZdgTXRNuTVXU=; b=QU6jb9SLq5wbN8MUwfZd6bu+Eev6ymEOgebEl+T8TLTINcL0/DW/D9GxBMEp2BmRKE 17ZNX2p+41Tof6vslWIwkLnNrGtGMophzqrW3xA+d7UQriotzeGa59fbeYyN+OwnOOgQ Zy3TMXuGNpC2xkIbR7q+wLigBtSj8hWpX/AhZUlnQUgCe4q4kI1Y8oqy2bx9eHmU5ae7 XDIIhFKUekqRHsEx7Zil1FxDd/zg+s4QIhYtboOHKZ51VmbPr/n9Kf7c5alE7Yt+uG3a Ns0fqQtBSmmSrPcQYBx+La5uXTEUz1Klf+yWKKrUBDnUOYA+DLUs04nDNBeynda++SEi E04g==","x-google-dkim-signature":"v=1; a=rsa-sha256; c=relaxed/relaxed; d=1e100.net; s=20161025; h=x-gm-message-state:mime-version:from:date:message-id:subject:to; bh=WNwtvK5+Ps6kgo1xd29wyUW3Jb/06thZdgTXRNuTVXU=; b=pcEkbo+OKDYHXH/mIbqXnCL5lOYCPwvPJWgsOyEi57jRRm+bBLpffpL++WraQHFL7w ayXTHd55fAjqP1bTrPw9iOm/6/u85OitAOSdIv6Fo3lFB4PDnRP6Z4QvLDN5dowiFb8d ZCyOiOMGS75GnS58Si3i4UdnAsSx8e4XkqxNWJBmdA/FsYVTgsUP4JBsddjY1ymqL7j3 Xi3Hf+xKOZxBjAw0oWhN9kRqmx96/cLVrrbG5bdonpPlRgxvfZpV5m+6sgTeFRarK7Mg vD5DPhDRYS9tYVIezyz3023L2QgU0jfZ8COLrEZf4lQPBKXCZZ06/YaS0am0z/KyBYVZ WF3g==","x-gm-message-state":"ALQs6tBQ6nthGqHtQAumszu/iJkh0F1ha1oYZQmYNkySYtYlg9TwzvrA 5j2irDw+BiZK282tI9kPWpIC5buxSDw3jXYNQ9/mmg==","x-google-smtp-source":"AIpwx4/jqF0Hv6Au/TjQ7xpQ9GIzLk2grekS9dmS05h4ec478SKUPfzT2i+jHwNvbHZexLiptUfCxy7X3R6Pk/V8dtM=","mime-version":"1.0","from":"Louis Barclay <louis.barclay+fred@gmail.com>","date":"Mon, 2 Apr 2018 15:54:54 +0100","message-id":"<CAL2-1RabqybTcugGjJGALpddjbJ1Qy-XWO1Mwzuwi0XoXDatgw@mail.gmail.com>","subject":"12_remove_fifth","to":"Louis Barclay <louis@sundaystori.es>","content-type":"multipart/alternative; boundary=\"94eb2c03f7b8dc986a0568dec5dd\""},"subject":"12_remove_fifth","messageId":"CAL2-1RabqybTcugGjJGALpddjbJ1Qy-XWO1Mwzuwi0XoXDatgw@mail.gmail.com","priority":"normal","from":[{"address":"louis.barclay+fred@gmail.com","name":"Louis Barclay"}],"to":[{"address":"louis@sundaystori.es","name":"Louis Barclay"}],"date":"2018-04-02T14:54:54.000Z","receivedDate":"2018-04-02T14:54:55.000Z","eml":"Delivered-To: louis@sundaystori.es\r\nReceived: by 10.100.153.134 with SMTP id 6csp2630911pji;\r\n        Mon, 2 Apr 2018 07:54:55 -0700 (PDT)\r\nX-Received: by 10.176.13.134 with SMTP id i6mr2968260uak.177.1522680895773;\r\n        Mon, 02 Apr 2018 07:54:55 -0700 (PDT)\r\nARC-Seal: i=1; a=rsa-sha256; t=1522680895; cv=none;\r\n        d=google.com; s=arc-20160816;\r\n        b=ofM5s5T0sYJ3E7rLYq14XgkHKjjScSY0A+Q7fr6pnFLHGBUMzMzY7KDdZfYzPkXUoJ\r\n         tjAip7HX3ZXeYxCqjp98+vWvwcJ4MhUxtTYFPjAESWkZYPps1OrnoJ3k7Yur4q1yEN99\r\n         Od5as75tdsR/6+/ooj++/eUk2f1qstMHrV5dWH9x7EhaxWTN6f4x+erOQF0xFiQC74sy\r\n         vAnO2GzuqECoCFKOqnaiu/LnJdvyxTJcJRtFE1digR/50XkQ2qVfaZWYXEcKbivNv2v+\r\n         35vDH+PZrDIVjw1zwcEiSuLd5JSl+IqyKdNFOlEZbVCDXu8UetqzjdJY/ADC5xvSKQLM\r\n         +Zqw==\r\nARC-Message-Signature: i=1; a=rsa-sha256; c=relaxed/relaxed; d=google.com; s=arc-20160816;\r\n        h=to:subject:message-id:date:from:mime-version:dkim-signature\r\n         :arc-authentication-results;\r\n        bh=WNwtvK5+Ps6kgo1xd29wyUW3Jb/06thZdgTXRNuTVXU=;\r\n        b=BTnR23CYzIb5FZTFxWciuoNh738UaE5QebIujNLaunTk+Cp8kxKX7ioOxJJ5qUUZ4h\r\n         qoIYSd8gBtWwlIslVe0XrXHBca2I3f96YzGH43y65mtmTrDzfqWgD759dKXIgl2JnlCw\r\n         VKvnNAWNSjGALPuGP8u+SrEA0IY7poIxaMR2/cKmoospccN4GGsN5YmDugzmN0OPrZdC\r\n         AHsUNxIdMv/ssVYd6ZMadgadqnwB440yMPvBeIw1U5O1RKjJ8GkwB68KHOM481ywG/Y0\r\n         mql5gH5k414soCgbLplFbss6EGfrwKMMAV3vscaUyVzU7b5/jDPejc73jtVGUcwpB80a\r\n         ZSyA==\r\nARC-Authentication-Results: i=1; mx.google.com;\r\n       dkim=pass header.i=@gmail.com header.s=20161025 header.b=QU6jb9SL;\r\n       spf=pass (google.com: domain of louis.barclay+fred@gmail.com designates 209.85.220.41 as permitted sender) smtp.mailfrom=louis.barclay+fred@gmail.com;\r\n       dmarc=pass (p=NONE sp=QUARANTINE dis=NONE) header.from=gmail.com\r\nReturn-Path: <louis.barclay+fred@gmail.com>\r\nReceived: from mail-sor-f41.google.com (mail-sor-f41.google.com. [209.85.220.41])\r\n        by mx.google.com with SMTPS id d7sor170046uaj.183.2018.04.02.07.54.55\r\n        for <louis@sundaystori.es>\r\n        (Google Transport Security);\r\n        Mon, 02 Apr 2018 07:54:55 -0700 (PDT)\r\nReceived-SPF: pass (google.com: domain of louis.barclay+fred@gmail.com designates 209.85.220.41 as permitted sender) client-ip=209.85.220.41;\r\nAuthentication-Results: mx.google.com;\r\n       dkim=pass header.i=@gmail.com header.s=20161025 header.b=QU6jb9SL;\r\n       spf=pass (google.com: domain of louis.barclay+fred@gmail.com designates 209.85.220.41 as permitted sender) smtp.mailfrom=louis.barclay+fred@gmail.com;\r\n       dmarc=pass (p=NONE sp=QUARANTINE dis=NONE) header.from=gmail.com\r\nDKIM-Signature: v=1; a=rsa-sha256; c=relaxed/relaxed;\r\n        d=gmail.com; s=20161025;\r\n        h=mime-version:from:date:message-id:subject:to;\r\n        bh=WNwtvK5+Ps6kgo1xd29wyUW3Jb/06thZdgTXRNuTVXU=;\r\n        b=QU6jb9SLq5wbN8MUwfZd6bu+Eev6ymEOgebEl+T8TLTINcL0/DW/D9GxBMEp2BmRKE\r\n         17ZNX2p+41Tof6vslWIwkLnNrGtGMophzqrW3xA+d7UQriotzeGa59fbeYyN+OwnOOgQ\r\n         Zy3TMXuGNpC2xkIbR7q+wLigBtSj8hWpX/AhZUlnQUgCe4q4kI1Y8oqy2bx9eHmU5ae7\r\n         XDIIhFKUekqRHsEx7Zil1FxDd/zg+s4QIhYtboOHKZ51VmbPr/n9Kf7c5alE7Yt+uG3a\r\n         Ns0fqQtBSmmSrPcQYBx+La5uXTEUz1Klf+yWKKrUBDnUOYA+DLUs04nDNBeynda++SEi\r\n         E04g==\r\nX-Google-DKIM-Signature: v=1; a=rsa-sha256; c=relaxed/relaxed;\r\n        d=1e100.net; s=20161025;\r\n        h=x-gm-message-state:mime-version:from:date:message-id:subject:to;\r\n        bh=WNwtvK5+Ps6kgo1xd29wyUW3Jb/06thZdgTXRNuTVXU=;\r\n        b=pcEkbo+OKDYHXH/mIbqXnCL5lOYCPwvPJWgsOyEi57jRRm+bBLpffpL++WraQHFL7w\r\n         ayXTHd55fAjqP1bTrPw9iOm/6/u85OitAOSdIv6Fo3lFB4PDnRP6Z4QvLDN5dowiFb8d\r\n         ZCyOiOMGS75GnS58Si3i4UdnAsSx8e4XkqxNWJBmdA/FsYVTgsUP4JBsddjY1ymqL7j3\r\n         Xi3Hf+xKOZxBjAw0oWhN9kRqmx96/cLVrrbG5bdonpPlRgxvfZpV5m+6sgTeFRarK7Mg\r\n         vD5DPhDRYS9tYVIezyz3023L2QgU0jfZ8COLrEZf4lQPBKXCZZ06/YaS0am0z/KyBYVZ\r\n         WF3g==\r\nX-Gm-Message-State: ALQs6tBQ6nthGqHtQAumszu/iJkh0F1ha1oYZQmYNkySYtYlg9TwzvrA\r\n\t5j2irDw+BiZK282tI9kPWpIC5buxSDw3jXYNQ9/mmg==\r\nX-Google-Smtp-Source: AIpwx4/jqF0Hv6Au/TjQ7xpQ9GIzLk2grekS9dmS05h4ec478SKUPfzT2i+jHwNvbHZexLiptUfCxy7X3R6Pk/V8dtM=\r\nX-Received: by 10.159.32.72 with SMTP id 66mr5716214uam.72.1522680895148; Mon,\r\n 02 Apr 2018 07:54:55 -0700 (PDT)\r\nMIME-Version: 1.0\r\nReceived: by 10.31.161.151 with HTTP; Mon, 2 Apr 2018 07:54:54 -0700 (PDT)\r\nFrom: Louis Barclay <louis.barclay+fred@gmail.com>\r\nDate: Mon, 2 Apr 2018 15:54:54 +0100\r\nMessage-ID: <CAL2-1RabqybTcugGjJGALpddjbJ1Qy-XWO1Mwzuwi0XoXDatgw@mail.gmail.com>\r\nSubject: 12_remove_fifth\r\nTo: Louis Barclay <louis@sundaystori.es>\r\nContent-Type: multipart/alternative; boundary=\"94eb2c03f7b8dc986a0568dec5dd\"\r\n\r\n--94eb2c03f7b8dc986a0568dec5dd\r\nContent-Type: text/plain; charset=\"UTF-8\"\r\n\r\nREMOVEWRITER louis.barclay@gmail.com\r\n\r\n--94eb2c03f7b8dc986a0568dec5dd\r\nContent-Type: text/html; charset=\"UTF-8\"\r\n\r\n<div dir=\"ltr\"><div class=\"gmail_default\" style=\"font-family:tahoma,sans-serif;font-size:small\">REMOVEREADER <a href=\"mailto:louis.barclay%2Bfifth@gmail.com\">louis.barclay+fifth@gmail.com</a></div></div>\r\n\r\n--94eb2c03f7b8dc986a0568dec5dd--\r\n"}