{"html":"<div dir=\"ltr\"><div class=\"gmail_default\" style=\"font-family:tahoma,sans-serif;font-size:small\">ADDREADER <a href=\"mailto:louis.barclay%2Bfifth@gmail.com\">louis.barclay+fifth@gmail.com</a></div><div class=\"gmail_default\" style=\"font-family:tahoma,sans-serif;font-size:small\">REMOVEREADER <a href=\"mailto:louis.barclay%2Bjanet@gmail.com\">louis.barclay+janet@gmail.com</a></div></div>\n","text":"ADDREADER louis.barclay+fifth@gmail.com\nREMOVEREADER louis.barclay+janet@gmail.com\n","headers":{"delivered-to":"louis@sundaystori.es","received":["by 10.100.153.134 with SMTP id 6csp2628913pji; Mon, 2 Apr 2018 07:52:49 -0700 (PDT)","from mail-sor-f41.google.com (mail-sor-f41.google.com. [209.85.220.41]) by mx.google.com with SMTPS id x206sor212681vkx.105.2018.04.02.07.52.49 for <louis@sundaystori.es> (Google Transport Security); Mon, 02 Apr 2018 07:52:49 -0700 (PDT)","by 10.31.161.151 with HTTP; Mon, 2 Apr 2018 07:52:48 -0700 (PDT)"],"x-received":["by 10.31.106.134 with SMTP id f128mr5253604vkc.139.1522680769812; Mon, 02 Apr 2018 07:52:49 -0700 (PDT)","by 10.31.138.1 with SMTP id m1mr5374042vkd.13.1522680768944; Mon, 02 Apr 2018 07:52:48 -0700 (PDT)"],"arc-seal":"i=1; a=rsa-sha256; t=1522680769; cv=none; d=google.com; s=arc-20160816; b=ufDcd2tOrCoKBYwMEa1Sya4VDs40M35syv77/LyanTcRTuMXHdFAehtkenSbGXZ2ps Z3JTH4BMlUT2IIKtqPoEUHoE/lgkovAadcX6i1Z9aoEgGqNLn5TGI/vrp/b22veLjP7O ld8hHat5nGv7HPqabxeCeGE+VZ2aJEA1YUU6gHVn7jEzpigtgzyC3JeKbRUdOem6+VJG L9Ymn53B8Y1rach+xw6+Z8kqBX3P4JHnzeGpYcWm8VNyf+2so669vxQjycfpQ14TF4ml 7qqAonz6zvZkNa+XV2copDpdUVNZyhqBKWkX4u8IOVlIunCRsToOd0kW0jpojN9iRwiX H9bQ==","arc-message-signature":"i=1; a=rsa-sha256; c=relaxed/relaxed; d=google.com; s=arc-20160816; h=to:subject:message-id:date:from:mime-version:dkim-signature :arc-authentication-results; bh=hjaUuGRK+hsCHaNTLCcO12cHahbMssPm9lo3pOtAjKI=; b=I7/CNEvTyqf1ihwfV9q2pR1fSgCdREiInYBlhZuqXtAaL2rsYMJwU98rBYE0qiSSLg 8JKB704DMGHXxrdtlIAR86awXvL+5wwV8dlmE5AqZN/5vCTeQ/cDrkHdhpSov65eBj0o N4aWsPR1OSFHCMkFmXDbjruZG/r878pheXI/cbTgWmQ6/afBF8GOPyoh5Qfuj4Onk5xD PMiQ8ZmzZqoedwjCmH928+CWCgwpnEaxzigopzf6FGEH+uvszJXuZD0Tq21x3SgXObvs CW4976q3boA5MeGuhndxij/VE6//PAfozIF6KQQgsCX3yBSLs1Cn4C98FZlYUXpZ/dE6 eW0Q==","arc-authentication-results":"i=1; mx.google.com; dkim=pass header.i=@gmail.com header.s=20161025 header.b=jubRDDuw; spf=pass (google.com: domain of louis.barclay@gmail.com designates 209.85.220.41 as permitted sender) smtp.mailfrom=louis.barclay@gmail.com; dmarc=pass (p=NONE sp=QUARANTINE dis=NONE) header.from=gmail.com","return-path":"<louis.barclay@gmail.com>","received-spf":"pass (google.com: domain of louis.barclay@gmail.com designates 209.85.220.41 as permitted sender) client-ip=209.85.220.41;","authentication-results":"mx.google.com; dkim=pass header.i=@gmail.com header.s=20161025 header.b=jubRDDuw; spf=pass (google.com: domain of louis.barclay@gmail.com designates 209.85.220.41 as permitted sender) smtp.mailfrom=louis.barclay@gmail.com; dmarc=pass (p=NONE sp=QUARANTINE dis=NONE) header.from=gmail.com","dkim-signature":"v=1; a=rsa-sha256; c=relaxed/relaxed; d=gmail.com; s=20161025; h=mime-version:from:date:message-id:subject:to; bh=hjaUuGRK+hsCHaNTLCcO12cHahbMssPm9lo3pOtAjKI=; b=jubRDDuw/gw3Osjyx4mXi7zR1yVL/rRM5RoRgpRjyAesgiJ7gtinoSsfLwNIh3lgNK ykypRwuA9pQ3EYChTlf452nJCQvWDzlcgJVLhTzbU2g8bXlIwgjMtueyPRXUTquogEOq v8A/VVBgZSgWT0EDfCA7bK4ffMqUJYpgLQnIi2QpmDJUCXZL9Ei7fEG1MT2ZDQzlsmey +p/o8k8izUH2pbYMWHu52E3pqeZ2ZHH4XNARFxn8QjWumSJIzuAFHCLxQVkOJg59RvVj ddzmO00olM9zN9Z6YHU902CFg0UdabSa5L9yXyrPYcdIzHpUVsW0Ou62ZkLD1XiUPJ12 x8AQ==","x-google-dkim-signature":"v=1; a=rsa-sha256; c=relaxed/relaxed; d=1e100.net; s=20161025; h=x-gm-message-state:mime-version:from:date:message-id:subject:to; bh=hjaUuGRK+hsCHaNTLCcO12cHahbMssPm9lo3pOtAjKI=; b=HKom4NBqDf9ZyXzdLYi+5ku/PdVl2sU1YJ3ZgsSRwG9czm66JwdhDIcZepPCzPun85 gFlcLhTWaU59E+H797QsWZtrV+PoIf5axozsjUqmpdw2qHtYoG98omWX3W9Lm18jauy1 ZEzgXiwZ2TyWqeYjxd1MeUL9OLgeVmG9MQUps+O5WEQfBnnXRHw83VE9D9gQ8pizz01H rSYzOuRtnwCphjJhx5YQDlTtoIlCigYzXyAVNfWkpmVONBvL6GI0/A2mgif6+yYJJHGT VIVfCqitTczK/zqpbAi3K9MpFZaI1tIhIl2pj2jlIWpERFX00AtdQiWxy15p18RHnwbw qFmQ==","x-gm-message-state":"ALQs6tB+R61bPgh9msDrBBNv05zVnK0WzerHOr/r+Tsqj7Q6TsSGIIJ0 8IfB97C4pI3cdINiF1/+j6nd6erBZT01ctks4wUQZw==","x-google-smtp-source":"AIpwx4+xx7OQDhKDZPlsK9tlrP0Al091q/UrQHa27RN8DiHF0Z76RlKLLL6kaMv6ToHV4i7annufnCZrZWGnCyC1ogE=","mime-version":"1.0","from":"Louis Barclay <louis.barclay@gmail.com>","date":"Mon, 2 Apr 2018 15:52:48 +0100","message-id":"<CAL2-1RY5XX7x5b9_cLSOp+EPFcfftbCEC=3j8SzQ83Wp7KNwaA@mail.gmail.com>","subject":"11_add_and_remove","to":"Louis Barclay <louis@sundaystori.es>","content-type":"multipart/alternative; boundary=\"001a1144f8a856e43b0568debe48\""},"subject":"11_add_and_remove","messageId":"CAL2-1RY5XX7x5b9_cLSOp+EPFcfftbCEC=3j8SzQ83Wp7KNwaA@mail.gmail.com","priority":"normal","from":[{"address":"louis.barclay@gmail.com","name":"Louis Barclay"}],"to":[{"address":"louis@sundaystori.es","name":"Louis Barclay"}],"date":"2018-04-02T14:52:48.000Z","receivedDate":"2018-04-02T14:52:49.000Z","eml":"Delivered-To: louis@sundaystori.es\r\nReceived: by 10.100.153.134 with SMTP id 6csp2628913pji;\r\n        Mon, 2 Apr 2018 07:52:49 -0700 (PDT)\r\nX-Received: by 10.31.106.134 with SMTP id f128mr5253604vkc.139.1522680769812;\r\n        Mon, 02 Apr 2018 07:52:49 -0700 (PDT)\r\nARC-Seal: i=1; a=rsa-sha256; t=1522680769; cv=none;\r\n        d=google.com; s=arc-20160816;\r\n        b=ufDcd2tOrCoKBYwMEa1Sya4VDs40M35syv77/LyanTcRTuMXHdFAehtkenSbGXZ2ps\r\n         Z3JTH4BMlUT2IIKtqPoEUHoE/lgkovAadcX6i1Z9aoEgGqNLn5TGI/vrp/b22veLjP7O\r\n         ld8hHat5nGv7HPqabxeCeGE+VZ2aJEA1YUU6gHVn7jEzpigtgzyC3JeKbRUdOem6+VJG\r\n         L9Ymn53B8Y1rach+xw6+Z8kqBX3P4JHnzeGpYcWm8VNyf+2so669vxQjycfpQ14TF4ml\r\n         7qqAonz6zvZkNa+XV2copDpdUVNZyhqBKWkX4u8IOVlIunCRsToOd0kW0jpojN9iRwiX\r\n         H9bQ==\r\nARC-Message-Signature: i=1; a=rsa-sha256; c=relaxed/relaxed; d=google.com; s=arc-20160816;\r\n        h=to:subject:message-id:date:from:mime-version:dkim-signature\r\n         :arc-authentication-results;\r\n        bh=hjaUuGRK+hsCHaNTLCcO12cHahbMssPm9lo3pOtAjKI=;\r\n        b=I7/CNEvTyqf1ihwfV9q2pR1fSgCdREiInYBlhZuqXtAaL2rsYMJwU98rBYE0qiSSLg\r\n         8JKB704DMGHXxrdtlIAR86awXvL+5wwV8dlmE5AqZN/5vCTeQ/cDrkHdhpSov65eBj0o\r\n         N4aWsPR1OSFHCMkFmXDbjruZG/r878pheXI/cbTgWmQ6/afBF8GOPyoh5Qfuj4Onk5xD\r\n         PMiQ8ZmzZqoedwjCmH928+CWCgwpnEaxzigopzf6FGEH+uvszJXuZD0Tq21x3SgXObvs\r\n         CW4976q3boA5MeGuhndxij/VE6//PAfozIF6KQQgsCX3yBSLs1Cn4C98FZlYUXpZ/dE6\r\n         eW0Q==\r\nARC-Authentication-Results: i=1; mx.google.com;\r\n       dkim=pass header.i=@gmail.com header.s=20161025 header.b=jubRDDuw;\r\n       spf=pass (google.com: domain of louis.barclay@gmail.com designates 209.85.220.41 as permitted sender) smtp.mailfrom=louis.barclay@gmail.com;\r\n       dmarc=pass (p=NONE sp=QUARANTINE dis=NONE) header.from=gmail.com\r\nReturn-Path: <louis.barclay@gmail.com>\r\nReceived: from mail-sor-f41.google.com (mail-sor-f41.google.com. [209.85.220.41])\r\n        by mx.google.com with SMTPS id x206sor212681vkx.105.2018.04.02.07.52.49\r\n        for <louis@sundaystori.es>\r\n        (Google Transport Security);\r\n        Mon, 02 Apr 2018 07:52:49 -0700 (PDT)\r\nReceived-SPF: pass (google.com: domain of louis.barclay@gmail.com designates 209.85.220.41 as permitted sender) client-ip=209.85.220.41;\r\nAuthentication-Results: mx.google.com;\r\n       dkim=pass header.i=@gmail.com header.s=20161025 header.b=jubRDDuw;\r\n       spf=pass (google.com: domain of louis.barclay@gmail.com designates 209.85.220.41 as permitted sender) smtp.mailfrom=louis.barclay@gmail.com;\r\n       dmarc=pass (p=NONE sp=QUARANTINE dis=NONE) header.from=gmail.com\r\nDKIM-Signature: v=1; a=rsa-sha256; c=relaxed/relaxed;\r\n        d=gmail.com; s=20161025;\r\n        h=mime-version:from:date:message-id:subject:to;\r\n        bh=hjaUuGRK+hsCHaNTLCcO12cHahbMssPm9lo3pOtAjKI=;\r\n        b=jubRDDuw/gw3Osjyx4mXi7zR1yVL/rRM5RoRgpRjyAesgiJ7gtinoSsfLwNIh3lgNK\r\n         ykypRwuA9pQ3EYChTlf452nJCQvWDzlcgJVLhTzbU2g8bXlIwgjMtueyPRXUTquogEOq\r\n         v8A/VVBgZSgWT0EDfCA7bK4ffMqUJYpgLQnIi2QpmDJUCXZL9Ei7fEG1MT2ZDQzlsmey\r\n         +p/o8k8izUH2pbYMWHu52E3pqeZ2ZHH4XNARFxn8QjWumSJIzuAFHCLxQVkOJg59RvVj\r\n         ddzmO00olM9zN9Z6YHU902CFg0UdabSa5L9yXyrPYcdIzHpUVsW0Ou62ZkLD1XiUPJ12\r\n         x8AQ==\r\nX-Google-DKIM-Signature: v=1; a=rsa-sha256; c=relaxed/relaxed;\r\n        d=1e100.net; s=20161025;\r\n        h=x-gm-message-state:mime-version:from:date:message-id:subject:to;\r\n        bh=hjaUuGRK+hsCHaNTLCcO12cHahbMssPm9lo3pOtAjKI=;\r\n        b=HKom4NBqDf9ZyXzdLYi+5ku/PdVl2sU1YJ3ZgsSRwG9czm66JwdhDIcZepPCzPun85\r\n         gFlcLhTWaU59E+H797QsWZtrV+PoIf5axozsjUqmpdw2qHtYoG98omWX3W9Lm18jauy1\r\n         ZEzgXiwZ2TyWqeYjxd1MeUL9OLgeVmG9MQUps+O5WEQfBnnXRHw83VE9D9gQ8pizz01H\r\n         rSYzOuRtnwCphjJhx5YQDlTtoIlCigYzXyAVNfWkpmVONBvL6GI0/A2mgif6+yYJJHGT\r\n         VIVfCqitTczK/zqpbAi3K9MpFZaI1tIhIl2pj2jlIWpERFX00AtdQiWxy15p18RHnwbw\r\n         qFmQ==\r\nX-Gm-Message-State: ALQs6tB+R61bPgh9msDrBBNv05zVnK0WzerHOr/r+Tsqj7Q6TsSGIIJ0\r\n\t8IfB97C4pI3cdINiF1/+j6nd6erBZT01ctks4wUQZw==\r\nX-Google-Smtp-Source: AIpwx4+xx7OQDhKDZPlsK9tlrP0Al091q/UrQHa27RN8DiHF0Z76RlKLLL6kaMv6ToHV4i7annufnCZrZWGnCyC1ogE=\r\nX-Received: by 10.31.138.1 with SMTP id m1mr5374042vkd.13.1522680768944; Mon,\r\n 02 Apr 2018 07:52:48 -0700 (PDT)\r\nMIME-Version: 1.0\r\nReceived: by 10.31.161.151 with HTTP; Mon, 2 Apr 2018 07:52:48 -0700 (PDT)\r\nFrom: Louis Barclay <louis.barclay@gmail.com>\r\nDate: Mon, 2 Apr 2018 15:52:48 +0100\r\nMessage-ID: <CAL2-1RY5XX7x5b9_cLSOp+EPFcfftbCEC=3j8SzQ83Wp7KNwaA@mail.gmail.com>\r\nSubject: 11_add_and_remove\r\nTo: Louis Barclay <louis@sundaystori.es>\r\nContent-Type: multipart/alternative; boundary=\"001a1144f8a856e43b0568debe48\"\r\n\r\n--001a1144f8a856e43b0568debe48\r\nContent-Type: text/plain; charset=\"UTF-8\"\r\n\r\nADDREADER louis.barclay+fifth@gmail.com\r\nREMOVEREADER louis.barclay+janet@gmail.com\r\n\r\n--001a1144f8a856e43b0568debe48\r\nContent-Type: text/html; charset=\"UTF-8\"\r\nContent-Transfer-Encoding: quoted-printable\r\n\r\n<div dir=3D\"ltr\"><div class=3D\"gmail_default\" style=3D\"font-family:tahoma,s=\r\nans-serif;font-size:small\">ADDREADER <a href=3D\"mailto:louis.barclay%2Bfift=\r\nh@gmail.com\">louis.barclay+fifth@gmail.com</a></div><div class=3D\"gmail_def=\r\nault\" style=3D\"font-family:tahoma,sans-serif;font-size:small\">REMOVEREADER =\r\n<a href=3D\"mailto:louis.barclay%2Bjanet@gmail.com\">louis.barclay+janet@gmai=\r\nl.com</a></div></div>\r\n\r\n--001a1144f8a856e43b0568debe48--\r\n"}