{"html":"<div dir=\"ltr\"><div class=\"gmail_default\" style=\"font-family:tahoma,sans-serif;font-size:small\">asdf aposdf</div></div>\n","text":"asdf aposdf\n","headers":{"delivered-to":"louis@sundaystori.es","received":["by 10.236.140.137 with SMTP id b9csp833332pjo; Tue, 20 Mar 2018 08:47:40 -0700 (PDT)","from mail-sor-f41.google.com (mail-sor-f41.google.com. [209.85.220.41]) by mx.google.com with SMTPS id p41sor735867uad.1.2018.03.20.08.47.40 for <louis@sundaystori.es> (Google Transport Security); Tue, 20 Mar 2018 08:47:40 -0700 (PDT)","by 10.31.161.20 with HTTP; Tue, 20 Mar 2018 08:47:39 -0700 (PDT)"],"x-received":["by 10.31.221.135 with SMTP id u129mr10578310vkg.186.1521560860795; Tue, 20 Mar 2018 08:47:40 -0700 (PDT)","by 10.176.22.82 with SMTP id l18mr11716791uae.126.1521560860122; Tue, 20 Mar 2018 08:47:40 -0700 (PDT)"],"arc-seal":"i=1; a=rsa-sha256; t=1521560860; cv=none; d=google.com; s=arc-20160816; b=r1pvcrFfL9s6TrhRgFKPkuWQRbBqUz8WIWmslMoc5cT01rg5O1hCqZicv9UYPIW1ag iv4cdYrVn9VJD+I4B0S5eVm79IjlqXw0ZPFyjwXmDmY2XaGGZsC8KJBQHUUjboNGE305 cxq/LO7KlF6Z2sNHyGggrW/I5eLHIO+S83uhFeuzo0AP0rvIq81MuFrCRDV4iQnAI7tI pGWJhVRWEnVqBaxhIG9zULKQCAkHVVDGmfgzBsucNcZY432Htp3SnE1rs5crQoubAheg 67HudG8GdE4/UR2VZLFxN8CpgvJsUTZZgTdMUkiN4pPW8u3yppK1K4oYPpOWRj2oeMG/ GB+w==","arc-message-signature":"i=1; a=rsa-sha256; c=relaxed/relaxed; d=google.com; s=arc-20160816; h=to:subject:message-id:date:from:mime-version:dkim-signature :arc-authentication-results; bh=zBbxZN70N2eRlgYgIj4AIhO2gKFzss6/FMz2+ODA0QE=; b=x0bKQWSOM+cz4JNa7Meghvy/IHDbB31ICzPCymCrD6c5xdezcduW8rPQMZ6TsD3bPf NxofiX9ciza+Vo9y2KDAe5D4SH5llEZa6a9RVjMaaDgS0vquXqlMksdjn/uCuk/soN9M UuW+j5DKsFuHiVDlKJRdEBuaRS2NPt7640YKtQKor17ddSbpJBwy0AjNmUlDrk65Ql8e JG0AdH527FIfAG2CAtCcSR//fK0Z4teA0k80hAOp/WMqiUvl3FVGsQTuWFN0cB94v87W hSQZMfrYfG+JhRxY9jMo4e4blruGNuuA2iND1WRXWtLHcVsMFUIJjettCyRklmEUnldV +AAg==","arc-authentication-results":"i=1; mx.google.com; dkim=pass header.i=@gmail.com header.s=20161025 header.b=l1637E1W; spf=pass (google.com: domain of louis.barclay@gmail.com designates 209.85.220.41 as permitted sender) smtp.mailfrom=louis.barclay@gmail.com; dmarc=pass (p=NONE sp=QUARANTINE dis=NONE) header.from=gmail.com","return-path":"<louis.barclay@gmail.com>","received-spf":"pass (google.com: domain of louis.barclay@gmail.com designates 209.85.220.41 as permitted sender) client-ip=209.85.220.41;","authentication-results":"mx.google.com; dkim=pass header.i=@gmail.com header.s=20161025 header.b=l1637E1W; spf=pass (google.com: domain of louis.barclay@gmail.com designates 209.85.220.41 as permitted sender) smtp.mailfrom=louis.barclay@gmail.com; dmarc=pass (p=NONE sp=QUARANTINE dis=NONE) header.from=gmail.com","dkim-signature":"v=1; a=rsa-sha256; c=relaxed/relaxed; d=gmail.com; s=20161025; h=mime-version:from:date:message-id:subject:to; bh=zBbxZN70N2eRlgYgIj4AIhO2gKFzss6/FMz2+ODA0QE=; b=l1637E1WFxoDWEHvJbfM7HxgVcbs5I/swUs9XAffwLAlovoik6fKCM6+f8L/frA61u VImS4nK9AW+/DEHM9oa90/mUuR+dSd2JQGm0o4IsJcz0zsMatFVGH9dfZZbG8yu7Wz6g 1Mu4b9aMC/fmo2rnZRe/7ZboIrDwl0Zc4V3YK4QlRVDby2Qv+ZF1Y3QUbMdE3/+XkqLH oWD6bda8LPU+DKEs96PtFd4o3K95u4w8L5/SBLU6c/it4PdekKyCsvefOLhsozmZlW0S 5LOdXxSCGSpcDc4vZqXfWPbrFcZv+mivGQEv94axbtLnXhMrPKMNL1TvuAkG8WZZagzw IrLA==","x-google-dkim-signature":"v=1; a=rsa-sha256; c=relaxed/relaxed; d=1e100.net; s=20161025; h=x-gm-message-state:mime-version:from:date:message-id:subject:to; bh=zBbxZN70N2eRlgYgIj4AIhO2gKFzss6/FMz2+ODA0QE=; b=d+uacjGHhMZs1MGKoykH59+JxSEZY6pDx5Bv/cgogYH7q0jofcu9g+iSbQ0BVB645j 8OZbmv1NqDRlnbQgd962MrZrabpUblYKmHphquVXpOn5/9aQEjSl3q6PRW2n4qUS5bOC 4S00iw32jgB+zpOLVij2XYV/cIeZNLwQxfD6igNK8R2C3zznTAUgdsfgW8Nfry2uLbVN aW4eZYKM+Empd5XmCgooBhuFdSXMbmDCYGSd6dMCnd1tr9FpPnwsnu5YggyxFtRuBIpq 2HZ4iR5Vj1QW57Oas2t4q3Qw7STQTxNn7cLfh4JyP/yc57aS0i4o0+sAe1pcV5ni40CH ACfw==","x-gm-message-state":"AElRT7FbBl84aGEcBxxhd6n7caicWX3l7PsxyjQT8M/QkdnK/0I5wOwe iBexbiAQypHMV+MuY1AX2dSNE6VNgcsxJFDW+wBr3Q==","x-google-smtp-source":"AG47ELupaMwM9rmA8pj4tOZs2iSYgiw0Ys7GJjILPI8nr1wJ7OfLuSvXyXoQTnhdzXvRSy5d0xVK36etTnqF052yHII=","mime-version":"1.0","from":"Louis Barclay <louis.barclay@gmail.com>","date":"Tue, 20 Mar 2018 15:47:39 +0000","message-id":"<CAL2-1RYNjxnm3X4uyTJd-CL48Bm9-aktxHFoznRSz853eBLmHQ@mail.gmail.com>","subject":"asdf some stuff","to":"Louis Barclay <louis@sundaystori.es>","content-type":"multipart/alternative; boundary=\"001a11456b3092649a0567d9fe54\""},"subject":"asdf some stuff","messageId":"CAL2-1RYNjxnm3X4uyTJd-CL48Bm9-aktxHFoznRSz853eBLmHQ@mail.gmail.com","priority":"normal","from":[{"address":"louis.barclay@gmail.com","name":"Louis Barclay"}],"to":[{"address":"louis@sundaystori.es","name":"Louis Barclay"}],"date":"2018-03-20T15:47:39.000Z","receivedDate":"2018-03-20T15:47:40.000Z","eml":"Delivered-To: louis@sundaystori.es\r\nReceived: by 10.236.140.137 with SMTP id b9csp833332pjo;\r\n        Tue, 20 Mar 2018 08:47:40 -0700 (PDT)\r\nX-Received: by 10.31.221.135 with SMTP id u129mr10578310vkg.186.1521560860795;\r\n        Tue, 20 Mar 2018 08:47:40 -0700 (PDT)\r\nARC-Seal: i=1; a=rsa-sha256; t=1521560860; cv=none;\r\n        d=google.com; s=arc-20160816;\r\n        b=r1pvcrFfL9s6TrhRgFKPkuWQRbBqUz8WIWmslMoc5cT01rg5O1hCqZicv9UYPIW1ag\r\n         iv4cdYrVn9VJD+I4B0S5eVm79IjlqXw0ZPFyjwXmDmY2XaGGZsC8KJBQHUUjboNGE305\r\n         cxq/LO7KlF6Z2sNHyGggrW/I5eLHIO+S83uhFeuzo0AP0rvIq81MuFrCRDV4iQnAI7tI\r\n         pGWJhVRWEnVqBaxhIG9zULKQCAkHVVDGmfgzBsucNcZY432Htp3SnE1rs5crQoubAheg\r\n         67HudG8GdE4/UR2VZLFxN8CpgvJsUTZZgTdMUkiN4pPW8u3yppK1K4oYPpOWRj2oeMG/\r\n         GB+w==\r\nARC-Message-Signature: i=1; a=rsa-sha256; c=relaxed/relaxed; d=google.com; s=arc-20160816;\r\n        h=to:subject:message-id:date:from:mime-version:dkim-signature\r\n         :arc-authentication-results;\r\n        bh=zBbxZN70N2eRlgYgIj4AIhO2gKFzss6/FMz2+ODA0QE=;\r\n        b=x0bKQWSOM+cz4JNa7Meghvy/IHDbB31ICzPCymCrD6c5xdezcduW8rPQMZ6TsD3bPf\r\n         NxofiX9ciza+Vo9y2KDAe5D4SH5llEZa6a9RVjMaaDgS0vquXqlMksdjn/uCuk/soN9M\r\n         UuW+j5DKsFuHiVDlKJRdEBuaRS2NPt7640YKtQKor17ddSbpJBwy0AjNmUlDrk65Ql8e\r\n         JG0AdH527FIfAG2CAtCcSR//fK0Z4teA0k80hAOp/WMqiUvl3FVGsQTuWFN0cB94v87W\r\n         hSQZMfrYfG+JhRxY9jMo4e4blruGNuuA2iND1WRXWtLHcVsMFUIJjettCyRklmEUnldV\r\n         +AAg==\r\nARC-Authentication-Results: i=1; mx.google.com;\r\n       dkim=pass header.i=@gmail.com header.s=20161025 header.b=l1637E1W;\r\n       spf=pass (google.com: domain of louis.barclay@gmail.com designates 209.85.220.41 as permitted sender) smtp.mailfrom=louis.barclay@gmail.com;\r\n       dmarc=pass (p=NONE sp=QUARANTINE dis=NONE) header.from=gmail.com\r\nReturn-Path: <louis.barclay@gmail.com>\r\nReceived: from mail-sor-f41.google.com (mail-sor-f41.google.com. [209.85.220.41])\r\n        by mx.google.com with SMTPS id p41sor735867uad.1.2018.03.20.08.47.40\r\n        for <louis@sundaystori.es>\r\n        (Google Transport Security);\r\n        Tue, 20 Mar 2018 08:47:40 -0700 (PDT)\r\nReceived-SPF: pass (google.com: domain of louis.barclay@gmail.com designates 209.85.220.41 as permitted sender) client-ip=209.85.220.41;\r\nAuthentication-Results: mx.google.com;\r\n       dkim=pass header.i=@gmail.com header.s=20161025 header.b=l1637E1W;\r\n       spf=pass (google.com: domain of louis.barclay@gmail.com designates 209.85.220.41 as permitted sender) smtp.mailfrom=louis.barclay@gmail.com;\r\n       dmarc=pass (p=NONE sp=QUARANTINE dis=NONE) header.from=gmail.com\r\nDKIM-Signature: v=1; a=rsa-sha256; c=relaxed/relaxed;\r\n        d=gmail.com; s=20161025;\r\n        h=mime-version:from:date:message-id:subject:to;\r\n        bh=zBbxZN70N2eRlgYgIj4AIhO2gKFzss6/FMz2+ODA0QE=;\r\n        b=l1637E1WFxoDWEHvJbfM7HxgVcbs5I/swUs9XAffwLAlovoik6fKCM6+f8L/frA61u\r\n         VImS4nK9AW+/DEHM9oa90/mUuR+dSd2JQGm0o4IsJcz0zsMatFVGH9dfZZbG8yu7Wz6g\r\n         1Mu4b9aMC/fmo2rnZRe/7ZboIrDwl0Zc4V3YK4QlRVDby2Qv+ZF1Y3QUbMdE3/+XkqLH\r\n         oWD6bda8LPU+DKEs96PtFd4o3K95u4w8L5/SBLU6c/it4PdekKyCsvefOLhsozmZlW0S\r\n         5LOdXxSCGSpcDc4vZqXfWPbrFcZv+mivGQEv94axbtLnXhMrPKMNL1TvuAkG8WZZagzw\r\n         IrLA==\r\nX-Google-DKIM-Signature: v=1; a=rsa-sha256; c=relaxed/relaxed;\r\n        d=1e100.net; s=20161025;\r\n        h=x-gm-message-state:mime-version:from:date:message-id:subject:to;\r\n        bh=zBbxZN70N2eRlgYgIj4AIhO2gKFzss6/FMz2+ODA0QE=;\r\n        b=d+uacjGHhMZs1MGKoykH59+JxSEZY6pDx5Bv/cgogYH7q0jofcu9g+iSbQ0BVB645j\r\n         8OZbmv1NqDRlnbQgd962MrZrabpUblYKmHphquVXpOn5/9aQEjSl3q6PRW2n4qUS5bOC\r\n         4S00iw32jgB+zpOLVij2XYV/cIeZNLwQxfD6igNK8R2C3zznTAUgdsfgW8Nfry2uLbVN\r\n         aW4eZYKM+Empd5XmCgooBhuFdSXMbmDCYGSd6dMCnd1tr9FpPnwsnu5YggyxFtRuBIpq\r\n         2HZ4iR5Vj1QW57Oas2t4q3Qw7STQTxNn7cLfh4JyP/yc57aS0i4o0+sAe1pcV5ni40CH\r\n         ACfw==\r\nX-Gm-Message-State: AElRT7FbBl84aGEcBxxhd6n7caicWX3l7PsxyjQT8M/QkdnK/0I5wOwe\r\n\tiBexbiAQypHMV+MuY1AX2dSNE6VNgcsxJFDW+wBr3Q==\r\nX-Google-Smtp-Source: AG47ELupaMwM9rmA8pj4tOZs2iSYgiw0Ys7GJjILPI8nr1wJ7OfLuSvXyXoQTnhdzXvRSy5d0xVK36etTnqF052yHII=\r\nX-Received: by 10.176.22.82 with SMTP id l18mr11716791uae.126.1521560860122;\r\n Tue, 20 Mar 2018 08:47:40 -0700 (PDT)\r\nMIME-Version: 1.0\r\nReceived: by 10.31.161.20 with HTTP; Tue, 20 Mar 2018 08:47:39 -0700 (PDT)\r\nFrom: Louis Barclay <louis.barclay@gmail.com>\r\nDate: Tue, 20 Mar 2018 15:47:39 +0000\r\nMessage-ID: <CAL2-1RYNjxnm3X4uyTJd-CL48Bm9-aktxHFoznRSz853eBLmHQ@mail.gmail.com>\r\nSubject: asdf some stuff\r\nTo: Louis Barclay <louis@sundaystori.es>\r\nContent-Type: multipart/alternative; boundary=\"001a11456b3092649a0567d9fe54\"\r\n\r\n--001a11456b3092649a0567d9fe54\r\nContent-Type: text/plain; charset=\"UTF-8\"\r\n\r\nasdf aposdf\r\n\r\n--001a11456b3092649a0567d9fe54\r\nContent-Type: text/html; charset=\"UTF-8\"\r\n\r\n<div dir=\"ltr\"><div class=\"gmail_default\" style=\"font-family:tahoma,sans-serif;font-size:small\">asdf aposdf</div></div>\r\n\r\n--001a11456b3092649a0567d9fe54--\r\n"}