{"html":"<div dir=\"ltr\"><div class=\"gmail_default\" style=\"font-family:tahoma,sans-serif;font-size:small\"><br></div></div>\n","text":"\n","headers":{"delivered-to":"louis@sundaystori.es","received":["by 10.236.140.137 with SMTP id b9csp1452059pjo; Tue, 13 Mar 2018 16:55:04 -0700 (PDT)","from mail-sor-f41.google.com (mail-sor-f41.google.com. [209.85.220.41]) by mx.google.com with SMTPS id g5sor606240vke.125.2018.03.13.16.55.04 for <louis@sundaystori.es> (Google Transport Security); Tue, 13 Mar 2018 16:55:04 -0700 (PDT)","by 10.31.10.8 with HTTP; Tue, 13 Mar 2018 16:55:03 -0700 (PDT)"],"x-received":["by 10.31.156.71 with SMTP id f68mr1957588vke.129.1520985304428; Tue, 13 Mar 2018 16:55:04 -0700 (PDT)","by 10.31.77.135 with SMTP id a129mr1823713vkb.108.1520985303792; Tue, 13 Mar 2018 16:55:03 -0700 (PDT)"],"arc-seal":"i=1; a=rsa-sha256; t=1520985304; cv=none; d=google.com; s=arc-20160816; b=rys6N0U0Bxfr74dOQUu2O3/Bgs+OicFFdcHJHonKYJ0VlpkQkVPAe+46PjiqzuQiIU WPKaFFLW0Vd+vfknSNb+667CQh3PTudoS2odjEa2NKcfnvswWaUqr1xmtjLRITCaVOPM nd3ADNzxxna0SyZXFKvwPl457dHaJNeN3ts1UUlCPl2nJ7xHsQSE/hUe+3Xotu0SnMyo /qQWqXqlKJi8q+52zwnPlT0d3b65nRLCF7Jt7A9oxgOyLgc96rqx+dFfnaWAPGZ0Ez/I 0jkWq22sLX+ZsQIe2ZcyLwyT+6t59CfMXvpETHudG3megkz6ppVzKmDPl/rKd2E4A7rt 7LCQ==","arc-message-signature":"i=1; a=rsa-sha256; c=relaxed/relaxed; d=google.com; s=arc-20160816; h=to:subject:message-id:date:from:mime-version:dkim-signature :arc-authentication-results; bh=Mg59l+C9bhEND8f8P0ysWwJTRluc6nR0/GBINDco62w=; b=v5goJnLe6CBKQJrSZlHo7g6pmpqc5dQLv90NsjeIXut1u+3zY5FxsDQW4U3cydyh8q n70CRx4ocwoJIZnZ9pjQOGljFCLRlzLTWtEpZXn1wSyBvjz9d/YNEeK1aguiRTl95Vpk X9UYKV9EM3v8Xc7U73+pcamOwX+XSO7yiDNxNjtRyL/TGezFTPxOcvcZrDpLqvNPX8E0 chwtMu6vfDl4ITCEro8xkjiBOpWCFXK0DivEFGt7KYwM32aK/U7e0QN/d5BR9KIcz7RY 4FN6ywc6zkmFJVLr26qktUrA6+eFw9PMbGRSAw/Otz1yQ/v5nPeFBAnfRZpFP6OA63PD d7PQ==","arc-authentication-results":"i=1; mx.google.com; dkim=pass header.i=@gmail.com header.s=20161025 header.b=goIyKB6+; spf=pass (google.com: domain of louis.barclay@gmail.com designates 209.85.220.41 as permitted sender) smtp.mailfrom=louis.barclay@gmail.com; dmarc=pass (p=NONE sp=QUARANTINE dis=NONE) header.from=gmail.com","return-path":"<louis.barclay@gmail.com>","received-spf":"pass (google.com: domain of louis.barclay@gmail.com designates 209.85.220.41 as permitted sender) client-ip=209.85.220.41;","authentication-results":"mx.google.com; dkim=pass header.i=@gmail.com header.s=20161025 header.b=goIyKB6+; spf=pass (google.com: domain of louis.barclay@gmail.com designates 209.85.220.41 as permitted sender) smtp.mailfrom=louis.barclay@gmail.com; dmarc=pass (p=NONE sp=QUARANTINE dis=NONE) header.from=gmail.com","dkim-signature":"v=1; a=rsa-sha256; c=relaxed/relaxed; d=gmail.com; s=20161025; h=mime-version:from:date:message-id:subject:to; bh=Mg59l+C9bhEND8f8P0ysWwJTRluc6nR0/GBINDco62w=; b=goIyKB6+KU6XX+Asgsy3gbLAcymvjx2704M9C2quWOyXozVKgTMlfrqRDACxA3+oTK U/6x9bK1O2ybpfWvthj/sVMfOiY+IK4kgxYHn93MG+p1ll5xuI4TOs+EoqRbPEf4sXtU gbHKxrYGp0z6koORE1cNsm7A3sRmKdjDi76JJ5eqNdPtNAhjvHhgXyGqXAhYDLG86+Dl Yyen8uNwO7lKpRFqiF6kkp1DxcrzxnJprFEClD/qOT/Jv9xCx7BdLf/STZYKLH1mqC8/ AL8Nxj4CL6SgeThr4lgnUa/F3aQKNK5/gI6zplWY15C7Ns3M6MfnMpECh1yN+wkEKsQq Mxcw==","x-google-dkim-signature":"v=1; a=rsa-sha256; c=relaxed/relaxed; d=1e100.net; s=20161025; h=x-gm-message-state:mime-version:from:date:message-id:subject:to; bh=Mg59l+C9bhEND8f8P0ysWwJTRluc6nR0/GBINDco62w=; b=Uhay0+R/zX68lTAEgWnKqy+HOKC2ezDlDVvJK32iGSilm0syhSFdAxdzgfdHtglwxC RjgLTtDc62wYtOi3w90haBPEynsXKHVWjvWf77syJZYPAdiKHdlpY57xqS+7Rbu7JOqg dVFEWY2ml9GItkyyQYdRqCOTkkgOIyEoscv0GSNSMOeFrIhPWF9Cogjs8ynILnCfs/Q7 e5/wrkpN7E2IDNoiql+4daE60pNzyE4Lhe7ArQUcycjHXdTj9eroi4e0r9zz8k4GiWwp RjrakLjPGFQhCU8ogpuW4lLpK28SsyO15wk2Hgz/cCetD89cQbwTjl4fgV+8G0DE7G5O a9Iw==","x-gm-message-state":"AElRT7F5s+MC6DOTW5Dobt54OyXM/GgtqJONke14/6BN6fTbc+D4c29O bNlv/XtSDtgbvbHH7eHQoUHFFa71b/qTwUx06RuX3A==","x-google-smtp-source":"AG47ELtYiFLpa07EVSc8hhPxxdWJDruj5wgYeFsSHuzr+srPq4KU9zT0WeIB21kZMbgpwg9tOpPK5J6P+qQHtk+oSKo=","mime-version":"1.0","from":"Louis Barclay <louis.barclay@gmail.com>","date":"Tue, 13 Mar 2018 23:55:03 +0000","message-id":"<CAL2-1RZjmOhAtFZbB2m=T8j4VP3SKF0BeERQa4Y2xJOk76wtYw@mail.gmail.com>","subject":"start it out","to":"Louis Barclay <louis@sundaystori.es>","content-type":"multipart/alternative; boundary=\"001a114da7acbdc0bd056753fccf\""},"subject":"start it out","messageId":"CAL2-1RZjmOhAtFZbB2m=T8j4VP3SKF0BeERQa4Y2xJOk76wtYw@mail.gmail.com","priority":"normal","from":[{"address":"louis.barclay@gmail.com","name":"Louis Barclay"}],"to":[{"address":"louis@sundaystori.es","name":"Louis Barclay"}],"date":"2018-03-13T23:55:03.000Z","receivedDate":"2018-03-13T23:55:04.000Z","eml":"Delivered-To: louis@sundaystori.es\r\nReceived: by 10.236.140.137 with SMTP id b9csp1452059pjo;\r\n        Tue, 13 Mar 2018 16:55:04 -0700 (PDT)\r\nX-Received: by 10.31.156.71 with SMTP id f68mr1957588vke.129.1520985304428;\r\n        Tue, 13 Mar 2018 16:55:04 -0700 (PDT)\r\nARC-Seal: i=1; a=rsa-sha256; t=1520985304; cv=none;\r\n        d=google.com; s=arc-20160816;\r\n        b=rys6N0U0Bxfr74dOQUu2O3/Bgs+OicFFdcHJHonKYJ0VlpkQkVPAe+46PjiqzuQiIU\r\n         WPKaFFLW0Vd+vfknSNb+667CQh3PTudoS2odjEa2NKcfnvswWaUqr1xmtjLRITCaVOPM\r\n         nd3ADNzxxna0SyZXFKvwPl457dHaJNeN3ts1UUlCPl2nJ7xHsQSE/hUe+3Xotu0SnMyo\r\n         /qQWqXqlKJi8q+52zwnPlT0d3b65nRLCF7Jt7A9oxgOyLgc96rqx+dFfnaWAPGZ0Ez/I\r\n         0jkWq22sLX+ZsQIe2ZcyLwyT+6t59CfMXvpETHudG3megkz6ppVzKmDPl/rKd2E4A7rt\r\n         7LCQ==\r\nARC-Message-Signature: i=1; a=rsa-sha256; c=relaxed/relaxed; d=google.com; s=arc-20160816;\r\n        h=to:subject:message-id:date:from:mime-version:dkim-signature\r\n         :arc-authentication-results;\r\n        bh=Mg59l+C9bhEND8f8P0ysWwJTRluc6nR0/GBINDco62w=;\r\n        b=v5goJnLe6CBKQJrSZlHo7g6pmpqc5dQLv90NsjeIXut1u+3zY5FxsDQW4U3cydyh8q\r\n         n70CRx4ocwoJIZnZ9pjQOGljFCLRlzLTWtEpZXn1wSyBvjz9d/YNEeK1aguiRTl95Vpk\r\n         X9UYKV9EM3v8Xc7U73+pcamOwX+XSO7yiDNxNjtRyL/TGezFTPxOcvcZrDpLqvNPX8E0\r\n         chwtMu6vfDl4ITCEro8xkjiBOpWCFXK0DivEFGt7KYwM32aK/U7e0QN/d5BR9KIcz7RY\r\n         4FN6ywc6zkmFJVLr26qktUrA6+eFw9PMbGRSAw/Otz1yQ/v5nPeFBAnfRZpFP6OA63PD\r\n         d7PQ==\r\nARC-Authentication-Results: i=1; mx.google.com;\r\n       dkim=pass header.i=@gmail.com header.s=20161025 header.b=goIyKB6+;\r\n       spf=pass (google.com: domain of louis.barclay@gmail.com designates 209.85.220.41 as permitted sender) smtp.mailfrom=louis.barclay@gmail.com;\r\n       dmarc=pass (p=NONE sp=QUARANTINE dis=NONE) header.from=gmail.com\r\nReturn-Path: <louis.barclay@gmail.com>\r\nReceived: from mail-sor-f41.google.com (mail-sor-f41.google.com. [209.85.220.41])\r\n        by mx.google.com with SMTPS id g5sor606240vke.125.2018.03.13.16.55.04\r\n        for <louis@sundaystori.es>\r\n        (Google Transport Security);\r\n        Tue, 13 Mar 2018 16:55:04 -0700 (PDT)\r\nReceived-SPF: pass (google.com: domain of louis.barclay@gmail.com designates 209.85.220.41 as permitted sender) client-ip=209.85.220.41;\r\nAuthentication-Results: mx.google.com;\r\n       dkim=pass header.i=@gmail.com header.s=20161025 header.b=goIyKB6+;\r\n       spf=pass (google.com: domain of louis.barclay@gmail.com designates 209.85.220.41 as permitted sender) smtp.mailfrom=louis.barclay@gmail.com;\r\n       dmarc=pass (p=NONE sp=QUARANTINE dis=NONE) header.from=gmail.com\r\nDKIM-Signature: v=1; a=rsa-sha256; c=relaxed/relaxed;\r\n        d=gmail.com; s=20161025;\r\n        h=mime-version:from:date:message-id:subject:to;\r\n        bh=Mg59l+C9bhEND8f8P0ysWwJTRluc6nR0/GBINDco62w=;\r\n        b=goIyKB6+KU6XX+Asgsy3gbLAcymvjx2704M9C2quWOyXozVKgTMlfrqRDACxA3+oTK\r\n         U/6x9bK1O2ybpfWvthj/sVMfOiY+IK4kgxYHn93MG+p1ll5xuI4TOs+EoqRbPEf4sXtU\r\n         gbHKxrYGp0z6koORE1cNsm7A3sRmKdjDi76JJ5eqNdPtNAhjvHhgXyGqXAhYDLG86+Dl\r\n         Yyen8uNwO7lKpRFqiF6kkp1DxcrzxnJprFEClD/qOT/Jv9xCx7BdLf/STZYKLH1mqC8/\r\n         AL8Nxj4CL6SgeThr4lgnUa/F3aQKNK5/gI6zplWY15C7Ns3M6MfnMpECh1yN+wkEKsQq\r\n         Mxcw==\r\nX-Google-DKIM-Signature: v=1; a=rsa-sha256; c=relaxed/relaxed;\r\n        d=1e100.net; s=20161025;\r\n        h=x-gm-message-state:mime-version:from:date:message-id:subject:to;\r\n        bh=Mg59l+C9bhEND8f8P0ysWwJTRluc6nR0/GBINDco62w=;\r\n        b=Uhay0+R/zX68lTAEgWnKqy+HOKC2ezDlDVvJK32iGSilm0syhSFdAxdzgfdHtglwxC\r\n         RjgLTtDc62wYtOi3w90haBPEynsXKHVWjvWf77syJZYPAdiKHdlpY57xqS+7Rbu7JOqg\r\n         dVFEWY2ml9GItkyyQYdRqCOTkkgOIyEoscv0GSNSMOeFrIhPWF9Cogjs8ynILnCfs/Q7\r\n         e5/wrkpN7E2IDNoiql+4daE60pNzyE4Lhe7ArQUcycjHXdTj9eroi4e0r9zz8k4GiWwp\r\n         RjrakLjPGFQhCU8ogpuW4lLpK28SsyO15wk2Hgz/cCetD89cQbwTjl4fgV+8G0DE7G5O\r\n         a9Iw==\r\nX-Gm-Message-State: AElRT7F5s+MC6DOTW5Dobt54OyXM/GgtqJONke14/6BN6fTbc+D4c29O\r\n\tbNlv/XtSDtgbvbHH7eHQoUHFFa71b/qTwUx06RuX3A==\r\nX-Google-Smtp-Source: AG47ELtYiFLpa07EVSc8hhPxxdWJDruj5wgYeFsSHuzr+srPq4KU9zT0WeIB21kZMbgpwg9tOpPK5J6P+qQHtk+oSKo=\r\nX-Received: by 10.31.77.135 with SMTP id a129mr1823713vkb.108.1520985303792;\r\n Tue, 13 Mar 2018 16:55:03 -0700 (PDT)\r\nMIME-Version: 1.0\r\nReceived: by 10.31.10.8 with HTTP; Tue, 13 Mar 2018 16:55:03 -0700 (PDT)\r\nFrom: Louis Barclay <louis.barclay@gmail.com>\r\nDate: Tue, 13 Mar 2018 23:55:03 +0000\r\nMessage-ID: <CAL2-1RZjmOhAtFZbB2m=T8j4VP3SKF0BeERQa4Y2xJOk76wtYw@mail.gmail.com>\r\nSubject: start it out\r\nTo: Louis Barclay <louis@sundaystori.es>\r\nContent-Type: multipart/alternative; boundary=\"001a114da7acbdc0bd056753fccf\"\r\n\r\n--001a114da7acbdc0bd056753fccf\r\nContent-Type: text/plain; charset=\"UTF-8\"\r\n\r\n\r\n\r\n--001a114da7acbdc0bd056753fccf\r\nContent-Type: text/html; charset=\"UTF-8\"\r\n\r\n<div dir=\"ltr\"><div class=\"gmail_default\" style=\"font-family:tahoma,sans-serif;font-size:small\"><br></div></div>\r\n\r\n--001a114da7acbdc0bd056753fccf--\r\n"}