{"html":"<div dir=\"ltr\"><div class=\"gmail_default\" style=\"font-family:tahoma,sans-serif;font-size:small\">i don&#39;t understand what to do</div></div>\n","text":"i don't understand what to do\n","headers":{"delivered-to":"write@sundaystori.es","received":["by 10.236.140.137 with SMTP id b9csp1218117pjo; Tue, 20 Mar 2018 15:24:46 -0700 (PDT)","from mail-sor-f41.google.com (mail-sor-f41.google.com. [209.85.220.41]) by mx.google.com with SMTPS id r9sor1149326uac.123.2018.03.20.15.24.45 for <write@sundaystori.es> (Google Transport Security); Tue, 20 Mar 2018 15:24:46 -0700 (PDT)","by 10.31.161.20 with HTTP; Tue, 20 Mar 2018 15:24:44 -0700 (PDT)"],"x-received":["by 10.176.19.115 with SMTP id h48mr2693461uae.135.1521584686051; Tue, 20 Mar 2018 15:24:46 -0700 (PDT)","by 10.159.60.143 with SMTP id s15mr12287248uai.56.1521584685425; Tue, 20 Mar 2018 15:24:45 -0700 (PDT)"],"arc-seal":"i=1; a=rsa-sha256; t=1521584686; cv=none; d=google.com; s=arc-20160816; b=ihzdxVAbgIZpYZLCZ0lLdOR5VN7DqQkesl/6JzTJQhw/PowRzHtBN58n/O4Lea7l/u I6n8seczQ4rI/L/s5GyGyF1gj8/J6doQXBCTlrWhx4v3BIfRF1ACYtzx/Tpqp85J1m0U vpbD1I53I6sf6EKrAtSboyZb9NA1pWf5B+/+5WcDklK2qxXbfyPppC28HPKZxiTX5vnJ ShUIOFchM2tbLMV8dOGkqDtr1AskVjbJ95EUvu/M0XWCt/LQrCh+Bf8cq4mqgSegNqte ko1W99eF92225issKplYsMXLCrAMKgVSlQ/Qrc8WussxBWecErZLiLmVglliqQNP4FUS jJ5A==","arc-message-signature":"i=1; a=rsa-sha256; c=relaxed/relaxed; d=google.com; s=arc-20160816; h=to:subject:message-id:date:from:mime-version:dkim-signature :arc-authentication-results; bh=hVN35aIB89Qx8H5nQJK30ElfM61cW96pYfCSUiZa6Rc=; b=RaGIMfG7C4DhVdVIHBCd0/xlPft7iO8HQDyC/MWe/N+7jrVOXiywWBDI/mBZJko9pk 2Dxiq+Y/QpPj6VDap1hG4oeRVxKUyyq5U96BxRWUHRFjIG1f/t7syVBsn0GTtWv+EQAd y/hkNXU0czMtOWYT2s1GhmTeHvXbZhFWhg8k3sSsQP0tl5xo8bFxYY/C17BrZyqUJSqX 4dAknQtl/3hKznKktpURuXugtX1TEb9a0ukbXgEhTGg0VN3CUvlZ78Uu599bCbyPoNax wXjsv2EczhNeJV8fLRFxN14J9XtqlKV+t/HVsLyHacHQsjt2Dt7YQh4GVrUrbkBpoUzf VEmA==","arc-authentication-results":"i=1; mx.google.com; dkim=pass header.i=@gmail.com header.s=20161025 header.b=X3Ql+K8r; spf=pass (google.com: domain of louis.barclay@gmail.com designates 209.85.220.41 as permitted sender) smtp.mailfrom=louis.barclay@gmail.com; dmarc=pass (p=NONE sp=QUARANTINE dis=NONE) header.from=gmail.com","return-path":"<louis.barclay@gmail.com>","received-spf":"pass (google.com: domain of louis.barclay@gmail.com designates 209.85.220.41 as permitted sender) client-ip=209.85.220.41;","authentication-results":"mx.google.com; dkim=pass header.i=@gmail.com header.s=20161025 header.b=X3Ql+K8r; spf=pass (google.com: domain of louis.barclay@gmail.com designates 209.85.220.41 as permitted sender) smtp.mailfrom=louis.barclay@gmail.com; dmarc=pass (p=NONE sp=QUARANTINE dis=NONE) header.from=gmail.com","dkim-signature":"v=1; a=rsa-sha256; c=relaxed/relaxed; d=gmail.com; s=20161025; h=mime-version:from:date:message-id:subject:to; bh=hVN35aIB89Qx8H5nQJK30ElfM61cW96pYfCSUiZa6Rc=; b=X3Ql+K8r3NwFMSToKFIAtjg3KGbAXMf1V0qEH5nDsiFO2Is26nc9h+gDTe/bbUg0fs LGeR/n+8pYfHVdEElktvOW0z/1exlAP6L4yIZNFLeGHmlHbKUIIi5/5QeGO0RDFzbt6u yoSGS5yrE9VlDrDx59zKd/hye23Xr4t2DIpbCXznnNtOanqlaQTotMwm9V3hX/cTnFse tGizmSoWLtTjOFLCGZMG2wrR555t0I40F5/ScBm6yhJB9+lx26h7I/THfapKUkGflW31 vm1qHwVbPD5lX5vi1MZaQPeqactAySko91SRvTPIDPQWr0eZz18/eh5eaF7TgotcaUid HgUA==","x-google-dkim-signature":"v=1; a=rsa-sha256; c=relaxed/relaxed; d=1e100.net; s=20161025; h=x-gm-message-state:mime-version:from:date:message-id:subject:to; bh=hVN35aIB89Qx8H5nQJK30ElfM61cW96pYfCSUiZa6Rc=; b=L/sYzEUnDCTY/WhuyOmEMfF3eiUkPTsVykjgmsKSiE9ycZDKBAFsjQvSkf9BM58k2q XRLxUqOyCiEBJPZp+MotZmvWEyGXFK5fVD/X9unD9nC+jY0S+WWUH6/ZDQQ2E5u4Xnir eQVOY0Ut4UG90B+UZiFa0Rbbsqz6D6mWg+7CLAGJuoHiEsB6et1cYjYaacrj57lVzbHt SBWdOt46wViMtX/9RqzNQZQ7rkUuus/Ft7kruxI1DEsBKyo7X6mcNVIR0QCJf0weOwaX Krmc/m6I8QOmnxaG8G13Gjr8fIdaFVkm+icCWidyF6d4fMFEXbzwKoKF8XHXvdYSqJLx O0eg==","x-gm-message-state":"AElRT7GZddi+2f9BB3qL2zNDTMydFkHAH+q5xB+Qkt7dkpIHXvvBRBVP 6DBnTb8gsm2bV6TXTYYStnquFcttqUBiU+IAdwmz5w==","x-google-smtp-source":"AG47ELsiacjpdvM6T/L6NBv0P/Xg1sLL3YxjXJgdo24kS1IdIsgs4xuA4t7VghUHz9aWS7oSxbjwPpHdZPkoa9SUhiY=","mime-version":"1.0","from":"Louis Barclay <louis.barclay@gmail.com>","date":"Tue, 20 Mar 2018 22:24:44 +0000","message-id":"<CAL2-1RbjOhn=vyRFHBz3VAp7n-R7VSacsQ+_LQmxEXwtyZERYg@mail.gmail.com>","subject":"2_wrong_sign_up","to":"Louis Barclay <write@sundaystori.es>","content-type":"multipart/alternative; boundary=\"f40304365e36aba9170567df8a8f\""},"subject":"2_wrong_sign_up","messageId":"CAL2-1RbjOhn=vyRFHBz3VAp7n-R7VSacsQ+_LQmxEXwtyZERYg@mail.gmail.com","priority":"normal","from":[{"address":"louis.barclay@gmail.com","name":"Louis Barclay"}],"to":[{"address":"write@sundaystori.es","name":"Louis Barclay"}],"date":"2018-03-20T22:24:44.000Z","receivedDate":"2018-03-20T22:24:46.000Z","eml":"Delivered-To: write@sundaystori.es\r\nReceived: by 10.236.140.137 with SMTP id b9csp1218117pjo;\r\n        Tue, 20 Mar 2018 15:24:46 -0700 (PDT)\r\nX-Received: by 10.176.19.115 with SMTP id h48mr2693461uae.135.1521584686051;\r\n        Tue, 20 Mar 2018 15:24:46 -0700 (PDT)\r\nARC-Seal: i=1; a=rsa-sha256; t=1521584686; cv=none;\r\n        d=google.com; s=arc-20160816;\r\n        b=ihzdxVAbgIZpYZLCZ0lLdOR5VN7DqQkesl/6JzTJQhw/PowRzHtBN58n/O4Lea7l/u\r\n         I6n8seczQ4rI/L/s5GyGyF1gj8/J6doQXBCTlrWhx4v3BIfRF1ACYtzx/Tpqp85J1m0U\r\n         vpbD1I53I6sf6EKrAtSboyZb9NA1pWf5B+/+5WcDklK2qxXbfyPppC28HPKZxiTX5vnJ\r\n         ShUIOFchM2tbLMV8dOGkqDtr1AskVjbJ95EUvu/M0XWCt/LQrCh+Bf8cq4mqgSegNqte\r\n         ko1W99eF92225issKplYsMXLCrAMKgVSlQ/Qrc8WussxBWecErZLiLmVglliqQNP4FUS\r\n         jJ5A==\r\nARC-Message-Signature: i=1; a=rsa-sha256; c=relaxed/relaxed; d=google.com; s=arc-20160816;\r\n        h=to:subject:message-id:date:from:mime-version:dkim-signature\r\n         :arc-authentication-results;\r\n        bh=hVN35aIB89Qx8H5nQJK30ElfM61cW96pYfCSUiZa6Rc=;\r\n        b=RaGIMfG7C4DhVdVIHBCd0/xlPft7iO8HQDyC/MWe/N+7jrVOXiywWBDI/mBZJko9pk\r\n         2Dxiq+Y/QpPj6VDap1hG4oeRVxKUyyq5U96BxRWUHRFjIG1f/t7syVBsn0GTtWv+EQAd\r\n         y/hkNXU0czMtOWYT2s1GhmTeHvXbZhFWhg8k3sSsQP0tl5xo8bFxYY/C17BrZyqUJSqX\r\n         4dAknQtl/3hKznKktpURuXugtX1TEb9a0ukbXgEhTGg0VN3CUvlZ78Uu599bCbyPoNax\r\n         wXjsv2EczhNeJV8fLRFxN14J9XtqlKV+t/HVsLyHacHQsjt2Dt7YQh4GVrUrbkBpoUzf\r\n         VEmA==\r\nARC-Authentication-Results: i=1; mx.google.com;\r\n       dkim=pass header.i=@gmail.com header.s=20161025 header.b=X3Ql+K8r;\r\n       spf=pass (google.com: domain of louis.barclay@gmail.com designates 209.85.220.41 as permitted sender) smtp.mailfrom=louis.barclay@gmail.com;\r\n       dmarc=pass (p=NONE sp=QUARANTINE dis=NONE) header.from=gmail.com\r\nReturn-Path: <louis.barclay@gmail.com>\r\nReceived: from mail-sor-f41.google.com (mail-sor-f41.google.com. [209.85.220.41])\r\n        by mx.google.com with SMTPS id r9sor1149326uac.123.2018.03.20.15.24.45\r\n        for <write@sundaystori.es>\r\n        (Google Transport Security);\r\n        Tue, 20 Mar 2018 15:24:46 -0700 (PDT)\r\nReceived-SPF: pass (google.com: domain of louis.barclay@gmail.com designates 209.85.220.41 as permitted sender) client-ip=209.85.220.41;\r\nAuthentication-Results: mx.google.com;\r\n       dkim=pass header.i=@gmail.com header.s=20161025 header.b=X3Ql+K8r;\r\n       spf=pass (google.com: domain of louis.barclay@gmail.com designates 209.85.220.41 as permitted sender) smtp.mailfrom=louis.barclay@gmail.com;\r\n       dmarc=pass (p=NONE sp=QUARANTINE dis=NONE) header.from=gmail.com\r\nDKIM-Signature: v=1; a=rsa-sha256; c=relaxed/relaxed;\r\n        d=gmail.com; s=20161025;\r\n        h=mime-version:from:date:message-id:subject:to;\r\n        bh=hVN35aIB89Qx8H5nQJK30ElfM61cW96pYfCSUiZa6Rc=;\r\n        b=X3Ql+K8r3NwFMSToKFIAtjg3KGbAXMf1V0qEH5nDsiFO2Is26nc9h+gDTe/bbUg0fs\r\n         LGeR/n+8pYfHVdEElktvOW0z/1exlAP6L4yIZNFLeGHmlHbKUIIi5/5QeGO0RDFzbt6u\r\n         yoSGS5yrE9VlDrDx59zKd/hye23Xr4t2DIpbCXznnNtOanqlaQTotMwm9V3hX/cTnFse\r\n         tGizmSoWLtTjOFLCGZMG2wrR555t0I40F5/ScBm6yhJB9+lx26h7I/THfapKUkGflW31\r\n         vm1qHwVbPD5lX5vi1MZaQPeqactAySko91SRvTPIDPQWr0eZz18/eh5eaF7TgotcaUid\r\n         HgUA==\r\nX-Google-DKIM-Signature: v=1; a=rsa-sha256; c=relaxed/relaxed;\r\n        d=1e100.net; s=20161025;\r\n        h=x-gm-message-state:mime-version:from:date:message-id:subject:to;\r\n        bh=hVN35aIB89Qx8H5nQJK30ElfM61cW96pYfCSUiZa6Rc=;\r\n        b=L/sYzEUnDCTY/WhuyOmEMfF3eiUkPTsVykjgmsKSiE9ycZDKBAFsjQvSkf9BM58k2q\r\n         XRLxUqOyCiEBJPZp+MotZmvWEyGXFK5fVD/X9unD9nC+jY0S+WWUH6/ZDQQ2E5u4Xnir\r\n         eQVOY0Ut4UG90B+UZiFa0Rbbsqz6D6mWg+7CLAGJuoHiEsB6et1cYjYaacrj57lVzbHt\r\n         SBWdOt46wViMtX/9RqzNQZQ7rkUuus/Ft7kruxI1DEsBKyo7X6mcNVIR0QCJf0weOwaX\r\n         Krmc/m6I8QOmnxaG8G13Gjr8fIdaFVkm+icCWidyF6d4fMFEXbzwKoKF8XHXvdYSqJLx\r\n         O0eg==\r\nX-Gm-Message-State: AElRT7GZddi+2f9BB3qL2zNDTMydFkHAH+q5xB+Qkt7dkpIHXvvBRBVP\r\n\t6DBnTb8gsm2bV6TXTYYStnquFcttqUBiU+IAdwmz5w==\r\nX-Google-Smtp-Source: AG47ELsiacjpdvM6T/L6NBv0P/Xg1sLL3YxjXJgdo24kS1IdIsgs4xuA4t7VghUHz9aWS7oSxbjwPpHdZPkoa9SUhiY=\r\nX-Received: by 10.159.60.143 with SMTP id s15mr12287248uai.56.1521584685425;\r\n Tue, 20 Mar 2018 15:24:45 -0700 (PDT)\r\nMIME-Version: 1.0\r\nReceived: by 10.31.161.20 with HTTP; Tue, 20 Mar 2018 15:24:44 -0700 (PDT)\r\nFrom: Louis Barclay <louis.barclay@gmail.com>\r\nDate: Tue, 20 Mar 2018 22:24:44 +0000\r\nMessage-ID: <CAL2-1RbjOhn=vyRFHBz3VAp7n-R7VSacsQ+_LQmxEXwtyZERYg@mail.gmail.com>\r\nSubject: 2_wrong_sign_up\r\nTo: Louis Barclay <write@sundaystori.es>\r\nContent-Type: multipart/alternative; boundary=\"f40304365e36aba9170567df8a8f\"\r\n\r\n--f40304365e36aba9170567df8a8f\r\nContent-Type: text/plain; charset=\"UTF-8\"\r\n\r\ni don't understand what to do\r\n\r\n--f40304365e36aba9170567df8a8f\r\nContent-Type: text/html; charset=\"UTF-8\"\r\n\r\n<div dir=\"ltr\"><div class=\"gmail_default\" style=\"font-family:tahoma,sans-serif;font-size:small\">i don&#39;t understand what to do</div></div>\r\n\r\n--f40304365e36aba9170567df8a8f--\r\n"}