{"html":"<div dir=\"ltr\"><div class=\"gmail_default\" style=\"font-family:tahoma,sans-serif;font-size:small\">CANCELSTORY</div></div>\n","text":"CANCELSTORY\n","headers":{"delivered-to":"write@sundaystori.es","received":["by 10.100.153.134 with SMTP id 6csp2379436pji; Mon, 2 Apr 2018 03:58:50 -0700 (PDT)","from mail-sor-f41.google.com (mail-sor-f41.google.com. [209.85.220.41]) by mx.google.com with SMTPS id r38sor37782uad.152.2018.04.02.03.58.50 for <write@sundaystori.es> (Google Transport Security); Mon, 02 Apr 2018 03:58:50 -0700 (PDT)","by 10.31.161.151 with HTTP; Mon, 2 Apr 2018 03:58:48 -0700 (PDT)"],"x-received":["by 10.176.95.217 with SMTP id g25mr5142538uaj.186.1522666730298; Mon, 02 Apr 2018 03:58:50 -0700 (PDT)","by 10.159.43.68 with SMTP id q4mr5429545uaj.78.1522666729589; Mon, 02 Apr 2018 03:58:49 -0700 (PDT)"],"arc-seal":"i=1; a=rsa-sha256; t=1522666730; cv=none; d=google.com; s=arc-20160816; b=nwYE05eYFQwEn9bXFWIbRpqhM1SvhLVBuLAKQQg4wY2tjZbA3wQJz++Wfh5JQdQq51 nPyYELTrQa/1CQkmbtCZKjgkt3YjIBcWp4LZRh+iEHK1woXxmfwhAewLkPdZCXM8j7uJ TBIG2i7WvbrvksK5wMP5j7EwaW5eGldgQ5bgj3ltTvD1rKwC6qNm27Gsvu6812YuijU6 2hvbHsScOoMWoHpKBwwT624SLOGLS3SlMtbD5qJZNKQt7MB10VrxW0h/1AAYdh4I5A1e T+kkpoeFaoNzC/xNCNEZfffQBFgk186AlbRz465LlI5exSNXi9rGAm02fbMmw8fTHBbV UZOg==","arc-message-signature":"i=1; a=rsa-sha256; c=relaxed/relaxed; d=google.com; s=arc-20160816; h=to:subject:message-id:date:from:mime-version:dkim-signature :arc-authentication-results; bh=SmpSQ7SuNyD2ZYNgmeKBvF1iHUoJKjGRUNphs+E+n3U=; b=VsZI/oKB8fmkMUkwb+U4DfHFzwUquYivRCSLFrRgnJCd7IwEGJfXPg8mX1+RvhKVns q7E1Q7D4pPyenob4IoN/9G84pAfGc7AwlYud7oMOWdRNGezrMMwhanR88qqtSD8+1Cv7 ZaechyG7wA8YaNy1vBbEM8HN5C1OnGbxAlR6JligZ/h345znNGBQkFwQUgKRk4hx601D AjzBiDOztNREiMl8UuK18N9NN0UiWwtJ+WJfvwSLwqOL16CQODSLmOy75Sb9RHsGhpGH nHBqMA1ua5JkYGs7TjwXIwutHGMJoTgeIFZhE4SH2YDxQRkeHFGYSyskmClyNGO39uYA /tsQ==","arc-authentication-results":"i=1; mx.google.com; dkim=pass header.i=@gmail.com header.s=20161025 header.b=SCZ83puX; spf=pass (google.com: domain of louis.barclay@gmail.com designates 209.85.220.41 as permitted sender) smtp.mailfrom=louis.barclay@gmail.com; dmarc=pass (p=NONE sp=QUARANTINE dis=NONE) header.from=gmail.com","return-path":"<louis.barclay@gmail.com>","received-spf":"pass (google.com: domain of louis.barclay@gmail.com designates 209.85.220.41 as permitted sender) client-ip=209.85.220.41;","authentication-results":"mx.google.com; dkim=pass header.i=@gmail.com header.s=20161025 header.b=SCZ83puX; spf=pass (google.com: domain of louis.barclay@gmail.com designates 209.85.220.41 as permitted sender) smtp.mailfrom=louis.barclay@gmail.com; dmarc=pass (p=NONE sp=QUARANTINE dis=NONE) header.from=gmail.com","dkim-signature":"v=1; a=rsa-sha256; c=relaxed/relaxed; d=gmail.com; s=20161025; h=mime-version:from:date:message-id:subject:to; bh=SmpSQ7SuNyD2ZYNgmeKBvF1iHUoJKjGRUNphs+E+n3U=; b=SCZ83puXo2XoFGCOJhdonUDiOmC2RUV7yZb6QcPTZeMx0Jjtmn2TaeryPL/gJaD8tt 0kosdLfVvdvOGuD30aYmO4KYCtAPQp2cArhwpt+jt8+DkUh/AuWrIyL7i7wKSbFiR/Jn cSvhHlOaZZKKbvnKXnm19fs0V9H1UsCBvtGSgOmeITQtF+/rF9lT++soesfycndVe40U TzMZb5mAkvwZpzCv6CUEihIPcgUMehFU2Yd6Bx6+4L2P4D1u0/PFMQARXwMBldXSi4Zp YSz7R/+xhMH3/YLJrYmczjjATJPNPCC+G2ZYhdEhQ4oEVpZ205dG8FK4bmW5P5W6bbBd NQ7Q==","x-google-dkim-signature":"v=1; a=rsa-sha256; c=relaxed/relaxed; d=1e100.net; s=20161025; h=x-gm-message-state:mime-version:from:date:message-id:subject:to; bh=SmpSQ7SuNyD2ZYNgmeKBvF1iHUoJKjGRUNphs+E+n3U=; b=cuFKhBAfsOGmEkVvkW+rapc5NGWE+XbyqJFPsEW+jBaWZ7YzTngdPncEY1h73JaMx4 yC/PXDKBFaIgYgT8Isa4kTzZJW1weJEqsY4S0E4ASomlhZ7+F4A33OaHbZdBHdYH+DDF T8/mlvN+g4PwGfMCzgrUj9nMoVf/78rYAs+DUwJ/MQ7kfqqIkj+O969Ay6UhgfVTxVbZ XQtGiNd+wPJr1Wjfer3gYTlnjHdPyvely35dGZ7YGO9BmYPyr6apegNaHWYeBnunAzZj YuCn1pCVnbro083oVyA1YLFNiRUFUx+mSIpD4u64MGAWS92/m9WBgMi/7hJ11wWw/zhH ivpg==","x-gm-message-state":"ALQs6tCZqL6a/vxgtz2hEkYVdznx50cgkFohxdnbAZrf1Uj1lY5RfQSR 53fFgDwou9XdP4KOnntRZgSRqJPgL+F5x6G0JstCQg==","x-google-smtp-source":"AIpwx4/w3oK5CtMYu+hQivY/XXI8QaJkmToPRSro/wBVu2OX0JmYODzMLIPzEF3phQQr9QH9unGT+aJR6ZzMZWBwK4g=","mime-version":"1.0","from":"Louis Barclay <louis.barclay@gmail.com>","date":"Mon, 2 Apr 2018 11:58:48 +0100","message-id":"<CAL2-1RaKgptdPJ=Hj19Vqtxvt-hC60s5kcw-YUJuX_iC65SV+w@mail.gmail.com>","subject":"9_cancel_story","to":"Louis Barclay <write@sundaystori.es>","content-type":"multipart/alternative; boundary=\"089e08240ca8874f340568db79a8\""},"subject":"9_cancel_story","messageId":"CAL2-1RaKgptdPJ=Hj19Vqtxvt-hC60s5kcw-YUJuX_iC65SV+w@mail.gmail.com","priority":"normal","from":[{"address":"louis.barclay@gmail.com","name":"Louis Barclay"}],"to":[{"address":"write@sundaystori.es","name":"Louis Barclay"}],"date":"2018-04-02T10:58:48.000Z","receivedDate":"2018-04-02T10:58:50.000Z","eml":"Delivered-To: write@sundaystori.es\r\nReceived: by 10.100.153.134 with SMTP id 6csp2379436pji;\r\n        Mon, 2 Apr 2018 03:58:50 -0700 (PDT)\r\nX-Received: by 10.176.95.217 with SMTP id g25mr5142538uaj.186.1522666730298;\r\n        Mon, 02 Apr 2018 03:58:50 -0700 (PDT)\r\nARC-Seal: i=1; a=rsa-sha256; t=1522666730; cv=none;\r\n        d=google.com; s=arc-20160816;\r\n        b=nwYE05eYFQwEn9bXFWIbRpqhM1SvhLVBuLAKQQg4wY2tjZbA3wQJz++Wfh5JQdQq51\r\n         nPyYELTrQa/1CQkmbtCZKjgkt3YjIBcWp4LZRh+iEHK1woXxmfwhAewLkPdZCXM8j7uJ\r\n         TBIG2i7WvbrvksK5wMP5j7EwaW5eGldgQ5bgj3ltTvD1rKwC6qNm27Gsvu6812YuijU6\r\n         2hvbHsScOoMWoHpKBwwT624SLOGLS3SlMtbD5qJZNKQt7MB10VrxW0h/1AAYdh4I5A1e\r\n         T+kkpoeFaoNzC/xNCNEZfffQBFgk186AlbRz465LlI5exSNXi9rGAm02fbMmw8fTHBbV\r\n         UZOg==\r\nARC-Message-Signature: i=1; a=rsa-sha256; c=relaxed/relaxed; d=google.com; s=arc-20160816;\r\n        h=to:subject:message-id:date:from:mime-version:dkim-signature\r\n         :arc-authentication-results;\r\n        bh=SmpSQ7SuNyD2ZYNgmeKBvF1iHUoJKjGRUNphs+E+n3U=;\r\n        b=VsZI/oKB8fmkMUkwb+U4DfHFzwUquYivRCSLFrRgnJCd7IwEGJfXPg8mX1+RvhKVns\r\n         q7E1Q7D4pPyenob4IoN/9G84pAfGc7AwlYud7oMOWdRNGezrMMwhanR88qqtSD8+1Cv7\r\n         ZaechyG7wA8YaNy1vBbEM8HN5C1OnGbxAlR6JligZ/h345znNGBQkFwQUgKRk4hx601D\r\n         AjzBiDOztNREiMl8UuK18N9NN0UiWwtJ+WJfvwSLwqOL16CQODSLmOy75Sb9RHsGhpGH\r\n         nHBqMA1ua5JkYGs7TjwXIwutHGMJoTgeIFZhE4SH2YDxQRkeHFGYSyskmClyNGO39uYA\r\n         /tsQ==\r\nARC-Authentication-Results: i=1; mx.google.com;\r\n       dkim=pass header.i=@gmail.com header.s=20161025 header.b=SCZ83puX;\r\n       spf=pass (google.com: domain of louis.barclay@gmail.com designates 209.85.220.41 as permitted sender) smtp.mailfrom=louis.barclay@gmail.com;\r\n       dmarc=pass (p=NONE sp=QUARANTINE dis=NONE) header.from=gmail.com\r\nReturn-Path: <louis.barclay@gmail.com>\r\nReceived: from mail-sor-f41.google.com (mail-sor-f41.google.com. [209.85.220.41])\r\n        by mx.google.com with SMTPS id r38sor37782uad.152.2018.04.02.03.58.50\r\n        for <write@sundaystori.es>\r\n        (Google Transport Security);\r\n        Mon, 02 Apr 2018 03:58:50 -0700 (PDT)\r\nReceived-SPF: pass (google.com: domain of louis.barclay@gmail.com designates 209.85.220.41 as permitted sender) client-ip=209.85.220.41;\r\nAuthentication-Results: mx.google.com;\r\n       dkim=pass header.i=@gmail.com header.s=20161025 header.b=SCZ83puX;\r\n       spf=pass (google.com: domain of louis.barclay@gmail.com designates 209.85.220.41 as permitted sender) smtp.mailfrom=louis.barclay@gmail.com;\r\n       dmarc=pass (p=NONE sp=QUARANTINE dis=NONE) header.from=gmail.com\r\nDKIM-Signature: v=1; a=rsa-sha256; c=relaxed/relaxed;\r\n        d=gmail.com; s=20161025;\r\n        h=mime-version:from:date:message-id:subject:to;\r\n        bh=SmpSQ7SuNyD2ZYNgmeKBvF1iHUoJKjGRUNphs+E+n3U=;\r\n        b=SCZ83puXo2XoFGCOJhdonUDiOmC2RUV7yZb6QcPTZeMx0Jjtmn2TaeryPL/gJaD8tt\r\n         0kosdLfVvdvOGuD30aYmO4KYCtAPQp2cArhwpt+jt8+DkUh/AuWrIyL7i7wKSbFiR/Jn\r\n         cSvhHlOaZZKKbvnKXnm19fs0V9H1UsCBvtGSgOmeITQtF+/rF9lT++soesfycndVe40U\r\n         TzMZb5mAkvwZpzCv6CUEihIPcgUMehFU2Yd6Bx6+4L2P4D1u0/PFMQARXwMBldXSi4Zp\r\n         YSz7R/+xhMH3/YLJrYmczjjATJPNPCC+G2ZYhdEhQ4oEVpZ205dG8FK4bmW5P5W6bbBd\r\n         NQ7Q==\r\nX-Google-DKIM-Signature: v=1; a=rsa-sha256; c=relaxed/relaxed;\r\n        d=1e100.net; s=20161025;\r\n        h=x-gm-message-state:mime-version:from:date:message-id:subject:to;\r\n        bh=SmpSQ7SuNyD2ZYNgmeKBvF1iHUoJKjGRUNphs+E+n3U=;\r\n        b=cuFKhBAfsOGmEkVvkW+rapc5NGWE+XbyqJFPsEW+jBaWZ7YzTngdPncEY1h73JaMx4\r\n         yC/PXDKBFaIgYgT8Isa4kTzZJW1weJEqsY4S0E4ASomlhZ7+F4A33OaHbZdBHdYH+DDF\r\n         T8/mlvN+g4PwGfMCzgrUj9nMoVf/78rYAs+DUwJ/MQ7kfqqIkj+O969Ay6UhgfVTxVbZ\r\n         XQtGiNd+wPJr1Wjfer3gYTlnjHdPyvely35dGZ7YGO9BmYPyr6apegNaHWYeBnunAzZj\r\n         YuCn1pCVnbro083oVyA1YLFNiRUFUx+mSIpD4u64MGAWS92/m9WBgMi/7hJ11wWw/zhH\r\n         ivpg==\r\nX-Gm-Message-State: ALQs6tCZqL6a/vxgtz2hEkYVdznx50cgkFohxdnbAZrf1Uj1lY5RfQSR\r\n\t53fFgDwou9XdP4KOnntRZgSRqJPgL+F5x6G0JstCQg==\r\nX-Google-Smtp-Source: AIpwx4/w3oK5CtMYu+hQivY/XXI8QaJkmToPRSro/wBVu2OX0JmYODzMLIPzEF3phQQr9QH9unGT+aJR6ZzMZWBwK4g=\r\nX-Received: by 10.159.43.68 with SMTP id q4mr5429545uaj.78.1522666729589; Mon,\r\n 02 Apr 2018 03:58:49 -0700 (PDT)\r\nMIME-Version: 1.0\r\nReceived: by 10.31.161.151 with HTTP; Mon, 2 Apr 2018 03:58:48 -0700 (PDT)\r\nFrom: Louis Barclay <louis.barclay@gmail.com>\r\nDate: Mon, 2 Apr 2018 11:58:48 +0100\r\nMessage-ID: <CAL2-1RaKgptdPJ=Hj19Vqtxvt-hC60s5kcw-YUJuX_iC65SV+w@mail.gmail.com>\r\nSubject: 9_cancel_story\r\nTo: Louis Barclay <write@sundaystori.es>\r\nContent-Type: multipart/alternative; boundary=\"089e08240ca8874f340568db79a8\"\r\n\r\n--089e08240ca8874f340568db79a8\r\nContent-Type: text/plain; charset=\"UTF-8\"\r\n\r\nCANCELSTORY\r\n\r\n--089e08240ca8874f340568db79a8\r\nContent-Type: text/html; charset=\"UTF-8\"\r\n\r\n<div dir=\"ltr\"><div class=\"gmail_default\" style=\"font-family:tahoma,sans-serif;font-size:small\">CANCELSTORY</div></div>\r\n\r\n--089e08240ca8874f340568db79a8--\r\n"}