{"html":"<div dir=\"ltr\"><div class=\"gmail_default\" style=\"font-family:tahoma,sans-serif;font-size:small\">ADDREADER <a href=\"mailto:louis.barclay%2Bhorty@gmail.com\">louis.barclay+horty@gmail.com</a></div></div>\n","text":"ADDREADER louis.barclay+horty@gmail.com\n","headers":{"delivered-to":"louis@sundaystori.es","received":["by 10.100.153.134 with SMTP id 6csp2380430pji; Mon, 2 Apr 2018 03:59:58 -0700 (PDT)","from mail-sor-f41.google.com (mail-sor-f41.google.com. [209.85.220.41]) by mx.google.com with SMTPS id 5sor38762vkj.261.2018.04.02.03.59.58 for <louis@sundaystori.es> (Google Transport Security); Mon, 02 Apr 2018 03:59:58 -0700 (PDT)","by 10.31.161.151 with HTTP; Mon, 2 Apr 2018 03:59:57 -0700 (PDT)"],"x-received":["by 10.31.107.200 with SMTP id k69mr4737562vki.198.1522666798474; Mon, 02 Apr 2018 03:59:58 -0700 (PDT)","by 10.31.138.1 with SMTP id m1mr4816804vkd.13.1522666797816; Mon, 02 Apr 2018 03:59:57 -0700 (PDT)"],"arc-seal":"i=1; a=rsa-sha256; t=1522666798; cv=none; d=google.com; s=arc-20160816; b=lvg6i7dpVbGAMEz53VT3L0k9WMFoQ/soIgGd5ofUKk9vafZTnIiadjMsTxEDVnkoth tYUV6k+tgSTNPjcV34ZRObHX7CSjDLodBSIvZWJsNJm3pJ3jA6zlSkZ1QIhJV4BrKNaC ZCTYS6hYUr4JcISbvPkjgFMCI1sGhrKVjRKi0ByTXplvk/CQThG5knq9cRAPPhwEO2oR WdzWKaqcsKm8aXgC6nPCfpWlL6FmmQR0Gip6i244UJQ9slJDsWrm4AtifhIb4SZhWGNe 6QrsvPbN22JGm2MCepDdsgS88x4O3hBe7lBUmm43q2/qti2eueNz/dAPwIAv80xOtMzj R91Q==","arc-message-signature":"i=1; a=rsa-sha256; c=relaxed/relaxed; d=google.com; s=arc-20160816; h=to:subject:message-id:date:from:mime-version:dkim-signature :arc-authentication-results; bh=NPpzmlRFIe4h9V0xCKdTFnNtD1FafyIb9VoGPlXKGAo=; b=n30Zxeoo1RIjWwN8rLQx51nklTB3bO/zhBOpxRFNBsgkZhTab5cglFwdNPdYMyVqad BLGTA7wW16tue5W/1UxlkgAtgUPFC8NzUedwjfyLfFStShIY8LSX/I5JlXLoCdIecPZg CZFAOp227aQyuB8jZEhuMCvKDNjWd9M7jKZTQ7bD9XaPbt2Xg8yznmGSU76MYj3UTJWY hI1dJarMPUwmt1XAxtPmHxanmHHpZIhnw977PLwE8hdTEA3e0fzHn1ZzWPup28rhViuV r6/jAQcWHLlDndrkq9+gX1hF3IIVxReYRltg/Ga9pyJ3TPBLDvZXUKs8SVpYp5VqSt7c 9dJg==","arc-authentication-results":"i=1; mx.google.com; dkim=pass header.i=@gmail.com header.s=20161025 header.b=b/PhVa+L; spf=pass (google.com: domain of louis.barclay@gmail.com designates 209.85.220.41 as permitted sender) smtp.mailfrom=louis.barclay@gmail.com; dmarc=pass (p=NONE sp=QUARANTINE dis=NONE) header.from=gmail.com","return-path":"<louis.barclay@gmail.com>","received-spf":"pass (google.com: domain of louis.barclay@gmail.com designates 209.85.220.41 as permitted sender) client-ip=209.85.220.41;","authentication-results":"mx.google.com; dkim=pass header.i=@gmail.com header.s=20161025 header.b=b/PhVa+L; spf=pass (google.com: domain of louis.barclay@gmail.com designates 209.85.220.41 as permitted sender) smtp.mailfrom=louis.barclay@gmail.com; dmarc=pass (p=NONE sp=QUARANTINE dis=NONE) header.from=gmail.com","dkim-signature":"v=1; a=rsa-sha256; c=relaxed/relaxed; d=gmail.com; s=20161025; h=mime-version:from:date:message-id:subject:to; bh=NPpzmlRFIe4h9V0xCKdTFnNtD1FafyIb9VoGPlXKGAo=; b=b/PhVa+LX13gcQhwA2TL3opRUamQehAv/DwTnXH4M158oN/krpjNioIVWSMZSQcl9k G1yQ5DlEYngFDk3uETiYejX/tJKwBMbZeDtxo9pQLWAf6PCEYYVrSF6NqcGr7QaRXhNv bAESlGMaXmxF+DxlWMXyID0gL5QEZKsezrjj2lhVAxv8ZCpQ5Zreh4bOZ1FGvZdEAfoN moyUJ89PXsZEah33TnKDsVvPXOnL/Hw4rx+UHmOi+hsUsmcCIoH343FdMp89pFoLkXZo dr2jPYXXBJEzNeqpAdu91bvCfuZMHOv+aB3WbYg8Yd7mWyC1P5YLFy1iK4RIXfJHdr21 /c4g==","x-google-dkim-signature":"v=1; a=rsa-sha256; c=relaxed/relaxed; d=1e100.net; s=20161025; h=x-gm-message-state:mime-version:from:date:message-id:subject:to; bh=NPpzmlRFIe4h9V0xCKdTFnNtD1FafyIb9VoGPlXKGAo=; b=qUMVRsebflIyMhNDRWUzvkF786C/7HR/cZCOLJEuDcgYS+T5gpTUy26Ve53tiPaeqV QdjqSmcW0GyXvsoFHXrDyGzXBlt6+V9CcGeP7rjqDzplglZbulIK4t3AW1IpMYGq5QpY 3Ix94qxUZn4j4TY8FiaPhydBXzWudRf1s0QZchc0QXun/3ZAvpH7XGL0U7m18+pyq4LQ nxp5BSyJe4My+nx2lxfYZ6GFi2ghwy/JLCZwRRIh0YTtTuXAb7Ibru7XSeB8pwDV+3hH CjJEBYLD3oIJxrUXdz4YQmQrLyiWN7+aKiXcG4Ej6BZExEk7qnfw7seeH1LZTvZbFhpw Fuww==","x-gm-message-state":"ALQs6tAeKqLPxyyWou96C+fbyG4lNsYLxdqlZsHFhAW+YGoJLddgagaY i7BNo0KNFT8t9npF/CF2hKDM3uXJA/Deqo8FHUOxWA==","x-google-smtp-source":"AIpwx49Lx1S2SDXqWnUaFZY38iuos4aKCjUViD8En+vAKx6Zpg3QpuKqrRRtivcv5hPn92HoG9N0wZiFyWlDzPbzpi0=","mime-version":"1.0","from":"Louis Barclay <louis.barclay@gmail.com>","date":"Mon, 2 Apr 2018 11:59:57 +0100","message-id":"<CAL2-1RYgAQc5uZPJ-NX6ee4KDT=Y7xBY9grTSV515AqMSnQsmw@mail.gmail.com>","subject":"10_add_reader","to":"Louis Barclay <louis@sundaystori.es>","content-type":"multipart/alternative; boundary=\"001a1144f8a8985f370568db7d94\""},"subject":"10_add_reader","messageId":"CAL2-1RYgAQc5uZPJ-NX6ee4KDT=Y7xBY9grTSV515AqMSnQsmw@mail.gmail.com","priority":"normal","from":[{"address":"louis.barclay@gmail.com","name":"Louis Barclay"}],"to":[{"address":"louis@sundaystori.es","name":"Louis Barclay"}],"date":"2018-04-02T10:59:57.000Z","receivedDate":"2018-04-02T10:59:58.000Z","eml":"Delivered-To: louis@sundaystori.es\r\nReceived: by 10.100.153.134 with SMTP id 6csp2380430pji;\r\n        Mon, 2 Apr 2018 03:59:58 -0700 (PDT)\r\nX-Received: by 10.31.107.200 with SMTP id k69mr4737562vki.198.1522666798474;\r\n        Mon, 02 Apr 2018 03:59:58 -0700 (PDT)\r\nARC-Seal: i=1; a=rsa-sha256; t=1522666798; cv=none;\r\n        d=google.com; s=arc-20160816;\r\n        b=lvg6i7dpVbGAMEz53VT3L0k9WMFoQ/soIgGd5ofUKk9vafZTnIiadjMsTxEDVnkoth\r\n         tYUV6k+tgSTNPjcV34ZRObHX7CSjDLodBSIvZWJsNJm3pJ3jA6zlSkZ1QIhJV4BrKNaC\r\n         ZCTYS6hYUr4JcISbvPkjgFMCI1sGhrKVjRKi0ByTXplvk/CQThG5knq9cRAPPhwEO2oR\r\n         WdzWKaqcsKm8aXgC6nPCfpWlL6FmmQR0Gip6i244UJQ9slJDsWrm4AtifhIb4SZhWGNe\r\n         6QrsvPbN22JGm2MCepDdsgS88x4O3hBe7lBUmm43q2/qti2eueNz/dAPwIAv80xOtMzj\r\n         R91Q==\r\nARC-Message-Signature: i=1; a=rsa-sha256; c=relaxed/relaxed; d=google.com; s=arc-20160816;\r\n        h=to:subject:message-id:date:from:mime-version:dkim-signature\r\n         :arc-authentication-results;\r\n        bh=NPpzmlRFIe4h9V0xCKdTFnNtD1FafyIb9VoGPlXKGAo=;\r\n        b=n30Zxeoo1RIjWwN8rLQx51nklTB3bO/zhBOpxRFNBsgkZhTab5cglFwdNPdYMyVqad\r\n         BLGTA7wW16tue5W/1UxlkgAtgUPFC8NzUedwjfyLfFStShIY8LSX/I5JlXLoCdIecPZg\r\n         CZFAOp227aQyuB8jZEhuMCvKDNjWd9M7jKZTQ7bD9XaPbt2Xg8yznmGSU76MYj3UTJWY\r\n         hI1dJarMPUwmt1XAxtPmHxanmHHpZIhnw977PLwE8hdTEA3e0fzHn1ZzWPup28rhViuV\r\n         r6/jAQcWHLlDndrkq9+gX1hF3IIVxReYRltg/Ga9pyJ3TPBLDvZXUKs8SVpYp5VqSt7c\r\n         9dJg==\r\nARC-Authentication-Results: i=1; mx.google.com;\r\n       dkim=pass header.i=@gmail.com header.s=20161025 header.b=b/PhVa+L;\r\n       spf=pass (google.com: domain of louis.barclay@gmail.com designates 209.85.220.41 as permitted sender) smtp.mailfrom=louis.barclay@gmail.com;\r\n       dmarc=pass (p=NONE sp=QUARANTINE dis=NONE) header.from=gmail.com\r\nReturn-Path: <louis.barclay@gmail.com>\r\nReceived: from mail-sor-f41.google.com (mail-sor-f41.google.com. [209.85.220.41])\r\n        by mx.google.com with SMTPS id 5sor38762vkj.261.2018.04.02.03.59.58\r\n        for <louis@sundaystori.es>\r\n        (Google Transport Security);\r\n        Mon, 02 Apr 2018 03:59:58 -0700 (PDT)\r\nReceived-SPF: pass (google.com: domain of louis.barclay@gmail.com designates 209.85.220.41 as permitted sender) client-ip=209.85.220.41;\r\nAuthentication-Results: mx.google.com;\r\n       dkim=pass header.i=@gmail.com header.s=20161025 header.b=b/PhVa+L;\r\n       spf=pass (google.com: domain of louis.barclay@gmail.com designates 209.85.220.41 as permitted sender) smtp.mailfrom=louis.barclay@gmail.com;\r\n       dmarc=pass (p=NONE sp=QUARANTINE dis=NONE) header.from=gmail.com\r\nDKIM-Signature: v=1; a=rsa-sha256; c=relaxed/relaxed;\r\n        d=gmail.com; s=20161025;\r\n        h=mime-version:from:date:message-id:subject:to;\r\n        bh=NPpzmlRFIe4h9V0xCKdTFnNtD1FafyIb9VoGPlXKGAo=;\r\n        b=b/PhVa+LX13gcQhwA2TL3opRUamQehAv/DwTnXH4M158oN/krpjNioIVWSMZSQcl9k\r\n         G1yQ5DlEYngFDk3uETiYejX/tJKwBMbZeDtxo9pQLWAf6PCEYYVrSF6NqcGr7QaRXhNv\r\n         bAESlGMaXmxF+DxlWMXyID0gL5QEZKsezrjj2lhVAxv8ZCpQ5Zreh4bOZ1FGvZdEAfoN\r\n         moyUJ89PXsZEah33TnKDsVvPXOnL/Hw4rx+UHmOi+hsUsmcCIoH343FdMp89pFoLkXZo\r\n         dr2jPYXXBJEzNeqpAdu91bvCfuZMHOv+aB3WbYg8Yd7mWyC1P5YLFy1iK4RIXfJHdr21\r\n         /c4g==\r\nX-Google-DKIM-Signature: v=1; a=rsa-sha256; c=relaxed/relaxed;\r\n        d=1e100.net; s=20161025;\r\n        h=x-gm-message-state:mime-version:from:date:message-id:subject:to;\r\n        bh=NPpzmlRFIe4h9V0xCKdTFnNtD1FafyIb9VoGPlXKGAo=;\r\n        b=qUMVRsebflIyMhNDRWUzvkF786C/7HR/cZCOLJEuDcgYS+T5gpTUy26Ve53tiPaeqV\r\n         QdjqSmcW0GyXvsoFHXrDyGzXBlt6+V9CcGeP7rjqDzplglZbulIK4t3AW1IpMYGq5QpY\r\n         3Ix94qxUZn4j4TY8FiaPhydBXzWudRf1s0QZchc0QXun/3ZAvpH7XGL0U7m18+pyq4LQ\r\n         nxp5BSyJe4My+nx2lxfYZ6GFi2ghwy/JLCZwRRIh0YTtTuXAb7Ibru7XSeB8pwDV+3hH\r\n         CjJEBYLD3oIJxrUXdz4YQmQrLyiWN7+aKiXcG4Ej6BZExEk7qnfw7seeH1LZTvZbFhpw\r\n         Fuww==\r\nX-Gm-Message-State: ALQs6tAeKqLPxyyWou96C+fbyG4lNsYLxdqlZsHFhAW+YGoJLddgagaY\r\n\ti7BNo0KNFT8t9npF/CF2hKDM3uXJA/Deqo8FHUOxWA==\r\nX-Google-Smtp-Source: AIpwx49Lx1S2SDXqWnUaFZY38iuos4aKCjUViD8En+vAKx6Zpg3QpuKqrRRtivcv5hPn92HoG9N0wZiFyWlDzPbzpi0=\r\nX-Received: by 10.31.138.1 with SMTP id m1mr4816804vkd.13.1522666797816; Mon,\r\n 02 Apr 2018 03:59:57 -0700 (PDT)\r\nMIME-Version: 1.0\r\nReceived: by 10.31.161.151 with HTTP; Mon, 2 Apr 2018 03:59:57 -0700 (PDT)\r\nFrom: Louis Barclay <louis.barclay@gmail.com>\r\nDate: Mon, 2 Apr 2018 11:59:57 +0100\r\nMessage-ID: <CAL2-1RYgAQc5uZPJ-NX6ee4KDT=Y7xBY9grTSV515AqMSnQsmw@mail.gmail.com>\r\nSubject: 10_add_reader\r\nTo: Louis Barclay <louis@sundaystori.es>\r\nContent-Type: multipart/alternative; boundary=\"001a1144f8a8985f370568db7d94\"\r\n\r\n--001a1144f8a8985f370568db7d94\r\nContent-Type: text/plain; charset=\"UTF-8\"\r\n\r\nADDREADER louis.barclay+horty@gmail.com\r\n\r\n--001a1144f8a8985f370568db7d94\r\nContent-Type: text/html; charset=\"UTF-8\"\r\n\r\n<div dir=\"ltr\"><div class=\"gmail_default\" style=\"font-family:tahoma,sans-serif;font-size:small\">ADDREADER <a href=\"mailto:louis.barclay%2Bhorty@gmail.com\">louis.barclay+horty@gmail.com</a></div></div>\r\n\r\n--001a1144f8a8985f370568db7d94--\r\n"}