{"html":"<div dir=\"ltr\"><div class=\"gmail_default\" style=\"font-family:tahoma,sans-serif;font-size:small\">NOTHANKS</div></div>\n","text":"NOTHANKS\n","headers":{"delivered-to":"louis@sundaystori.es","received":["by 10.236.140.137 with SMTP id b9csp2045327pjo; Wed, 21 Mar 2018 08:01:23 -0700 (PDT)","from mail-sor-f41.google.com (mail-sor-f41.google.com. [209.85.220.41]) by mx.google.com with SMTPS id 66sor1568650uan.296.2018.03.21.08.01.23 for <louis@sundaystori.es> (Google Transport Security); Wed, 21 Mar 2018 08:01:23 -0700 (PDT)","by 10.31.161.20 with HTTP; Wed, 21 Mar 2018 08:01:21 -0700 (PDT)"],"x-received":["by 10.28.237.19 with SMTP id l19mr2772887wmh.157.1521644483634; Wed, 21 Mar 2018 08:01:23 -0700 (PDT)","by 10.159.61.88 with SMTP id m24mr12909329uai.65.1521644482343; Wed, 21 Mar 2018 08:01:22 -0700 (PDT)"],"arc-seal":"i=1; a=rsa-sha256; t=1521644483; cv=none; d=google.com; s=arc-20160816; b=HmeXzovVJ0UAPmLTnX1KP00X8ZwqfAPm/xrpIfbRUI57D1hvUg+1WJ7wiQHhSA9SAZ I//8YshvEFqIE2wZnZswYfYO8hKP8qJZ/RvHXt3fcNeLrMDCTomoaQZc5iL08C1KMOE4 if0d2mI58bTr9hlRCsDUTNiqDi5FFd03sXUz8t/X6BH5S8Z8HfDnQuapttl65bDrU/8N 9Sp4Mvx0n/vCrEMKUziuyMjJkd78rPMXBt7TU/ziEYG5U+LYCFyIgJIzzddDdZL3nEHU 3n8xai9kkrSRoFUOlDRcNu9NusxybXSZazNkAz8VY+2XF+tA0pvOSB0J9cfUiRieDtGv Ej4Q==","arc-message-signature":"i=1; a=rsa-sha256; c=relaxed/relaxed; d=google.com; s=arc-20160816; h=to:subject:message-id:date:from:mime-version:dkim-signature :arc-authentication-results; bh=XwvukC6yYTsXbZ1Jsw6g3fF4j+v+k0aKND6HP291z2g=; b=DLHXFMVGFXyNjn1PRNcV1YqhYJ5tsT8MKwjk+ScS0kzUcl7RnRfjjKVfy+6sVwAyij KiBEAHxTkO1f+X/3WxlgsJy1OvLPp+VPadHc8elTHdc3D1M1Yqh2VNfcUszvUF0ZMTQx 4/5PKDdPFz/12C6XhXAF9qjboJKVreNaXAMj0fDd4cHeSaILpJCnB1RW+0iuP9zsvbwR kZXiM/7QfSQyVwDezWPu4GFrxI2LSSbJ+y8eI72c4MSi/grf6zRjtYYlvX1F0Q+W/UQJ zE/ntgy/IQUJxpcm16bnbtEzdsi08edRMmIG1VSH82lUTt1yXEi3zRFkGlgmsaVFUiNk eGlA==","arc-authentication-results":"i=1; mx.google.com; dkim=pass header.i=@gmail.com header.s=20161025 header.b=paTboiMq; spf=pass (google.com: domain of louis.barclay+janet@gmail.com designates 209.85.220.41 as permitted sender) smtp.mailfrom=louis.barclay+janet@gmail.com; dmarc=pass (p=NONE sp=QUARANTINE dis=NONE) header.from=gmail.com","return-path":"<louis.barclay+janet@gmail.com>","received-spf":"pass (google.com: domain of louis.barclay+janet@gmail.com designates 209.85.220.41 as permitted sender) client-ip=209.85.220.41;","authentication-results":"mx.google.com; dkim=pass header.i=@gmail.com header.s=20161025 header.b=paTboiMq; spf=pass (google.com: domain of louis.barclay+janet@gmail.com designates 209.85.220.41 as permitted sender) smtp.mailfrom=louis.barclay+janet@gmail.com; dmarc=pass (p=NONE sp=QUARANTINE dis=NONE) header.from=gmail.com","dkim-signature":"v=1; a=rsa-sha256; c=relaxed/relaxed; d=gmail.com; s=20161025; h=mime-version:from:date:message-id:subject:to; bh=XwvukC6yYTsXbZ1Jsw6g3fF4j+v+k0aKND6HP291z2g=; b=paTboiMqmLPDYXankFORSx+Sp83OQG1HT+//IMkahqSTvbb1OV1Y2V6MVOKKJY6HUS WRc+VVQeBG1vQpLN8n65o0GWQ2JRFKeo+PD8RGOCpIFsP0qALlgNocy1+q5uizRQ1AlM 1I56pYkIsc5ynnr8wHuCZN94b3z4XA4tedLwL6TGOSmotqZ1JYjr5bGsEpfwOUzwTaYr WT4j2rgkBGLC7ZXwepjABa3l2X1IU3MNaXa/eYYfjBczyGdYEOn6KEU0IXRxCXjkKp6o GYKp20YxkoXHSyXr+unuIICl32V9Xv+59Gk+tCv5jgbUrMEjdHTU3KS2RbSkdeExk/yd RzFg==","x-google-dkim-signature":"v=1; a=rsa-sha256; c=relaxed/relaxed; d=1e100.net; s=20161025; h=x-gm-message-state:mime-version:from:date:message-id:subject:to; bh=XwvukC6yYTsXbZ1Jsw6g3fF4j+v+k0aKND6HP291z2g=; b=WzMZOUu46lJrIruJfeydPr55LlNuZMRI0mhA+TpooPt1bXuhipuoxhhT5FkulJizhq ln8JbEzVfifM9qeolRYrl/Ebp4bZ/+NDU2P6r6JtEp6vAgiAguhVMlrpXY2ZBDQXytsy MxDASJHtnTmWjwycw1ui1hG8dLm7vFtr3HKSgmIIOeXmIE4h5/wczpKuKgYiskW8MgYC uFXgdGROggqhSdLqFTb/Wc0S3aPZ8CDTPAUddHbzD3HXF4jP7myG42z/wMFvEOb9K3zB gmHFejeIrPAVhcJ4JeWANg17tyn9iu5ZW7gq2HzKhOP9gK7fskjPSJAB3JikUD91snUP 8aNQ==","x-gm-message-state":"AElRT7G1IxjezhVZd3dqz2qZDqo6uzGYJJ0cXS+djcEPps2K7w+qvptb oU9sVBq24BVftMi7+1JK7y1z8snLfIcNrUvxiHdrMQ==","x-google-smtp-source":"AG47ELu6BEbwIKpO4SXZwBfpAAvEQiqbVLZZTiNNkgSuzoD/QP2pd1TA3eO36VGkNIJJuP8CcaibGvBSxaV5Whunt8k=","mime-version":"1.0","from":"Louis Barclay <louis.barclay+janet@gmail.com>","date":"Wed, 21 Mar 2018 15:01:21 +0000","message-id":"<CAL2-1RZmRj3Wu-R57_KUgg06AGpGGqo5rbiXTDqsCPQ-5+61cQ@mail.gmail.com>","subject":"4_janet_deletion","to":"Louis Barclay <louis@sundaystori.es>","content-type":"multipart/alternative; boundary=\"f403043664f8d842850567ed76b6\""},"subject":"4_janet_deletion","messageId":"CAL2-1RZmRj3Wu-R57_KUgg06AGpGGqo5rbiXTDqsCPQ-5+61cQ@mail.gmail.com","priority":"normal","from":[{"address":"louis.barclay+janet@gmail.com","name":"Louis Barclay"}],"to":[{"address":"louis@sundaystori.es","name":"Louis Barclay"}],"date":"2018-03-21T15:01:21.000Z","receivedDate":"2018-03-21T15:01:23.000Z","eml":"Delivered-To: louis@sundaystori.es\r\nReceived: by 10.236.140.137 with SMTP id b9csp2045327pjo;\r\n        Wed, 21 Mar 2018 08:01:23 -0700 (PDT)\r\nX-Received: by 10.28.237.19 with SMTP id l19mr2772887wmh.157.1521644483634;\r\n        Wed, 21 Mar 2018 08:01:23 -0700 (PDT)\r\nARC-Seal: i=1; a=rsa-sha256; t=1521644483; cv=none;\r\n        d=google.com; s=arc-20160816;\r\n        b=HmeXzovVJ0UAPmLTnX1KP00X8ZwqfAPm/xrpIfbRUI57D1hvUg+1WJ7wiQHhSA9SAZ\r\n         I//8YshvEFqIE2wZnZswYfYO8hKP8qJZ/RvHXt3fcNeLrMDCTomoaQZc5iL08C1KMOE4\r\n         if0d2mI58bTr9hlRCsDUTNiqDi5FFd03sXUz8t/X6BH5S8Z8HfDnQuapttl65bDrU/8N\r\n         9Sp4Mvx0n/vCrEMKUziuyMjJkd78rPMXBt7TU/ziEYG5U+LYCFyIgJIzzddDdZL3nEHU\r\n         3n8xai9kkrSRoFUOlDRcNu9NusxybXSZazNkAz8VY+2XF+tA0pvOSB0J9cfUiRieDtGv\r\n         Ej4Q==\r\nARC-Message-Signature: i=1; a=rsa-sha256; c=relaxed/relaxed; d=google.com; s=arc-20160816;\r\n        h=to:subject:message-id:date:from:mime-version:dkim-signature\r\n         :arc-authentication-results;\r\n        bh=XwvukC6yYTsXbZ1Jsw6g3fF4j+v+k0aKND6HP291z2g=;\r\n        b=DLHXFMVGFXyNjn1PRNcV1YqhYJ5tsT8MKwjk+ScS0kzUcl7RnRfjjKVfy+6sVwAyij\r\n         KiBEAHxTkO1f+X/3WxlgsJy1OvLPp+VPadHc8elTHdc3D1M1Yqh2VNfcUszvUF0ZMTQx\r\n         4/5PKDdPFz/12C6XhXAF9qjboJKVreNaXAMj0fDd4cHeSaILpJCnB1RW+0iuP9zsvbwR\r\n         kZXiM/7QfSQyVwDezWPu4GFrxI2LSSbJ+y8eI72c4MSi/grf6zRjtYYlvX1F0Q+W/UQJ\r\n         zE/ntgy/IQUJxpcm16bnbtEzdsi08edRMmIG1VSH82lUTt1yXEi3zRFkGlgmsaVFUiNk\r\n         eGlA==\r\nARC-Authentication-Results: i=1; mx.google.com;\r\n       dkim=pass header.i=@gmail.com header.s=20161025 header.b=paTboiMq;\r\n       spf=pass (google.com: domain of louis.barclay+janet@gmail.com designates 209.85.220.41 as permitted sender) smtp.mailfrom=louis.barclay+janet@gmail.com;\r\n       dmarc=pass (p=NONE sp=QUARANTINE dis=NONE) header.from=gmail.com\r\nReturn-Path: <louis.barclay+janet@gmail.com>\r\nReceived: from mail-sor-f41.google.com (mail-sor-f41.google.com. [209.85.220.41])\r\n        by mx.google.com with SMTPS id 66sor1568650uan.296.2018.03.21.08.01.23\r\n        for <louis@sundaystori.es>\r\n        (Google Transport Security);\r\n        Wed, 21 Mar 2018 08:01:23 -0700 (PDT)\r\nReceived-SPF: pass (google.com: domain of louis.barclay+janet@gmail.com designates 209.85.220.41 as permitted sender) client-ip=209.85.220.41;\r\nAuthentication-Results: mx.google.com;\r\n       dkim=pass header.i=@gmail.com header.s=20161025 header.b=paTboiMq;\r\n       spf=pass (google.com: domain of louis.barclay+janet@gmail.com designates 209.85.220.41 as permitted sender) smtp.mailfrom=louis.barclay+janet@gmail.com;\r\n       dmarc=pass (p=NONE sp=QUARANTINE dis=NONE) header.from=gmail.com\r\nDKIM-Signature: v=1; a=rsa-sha256; c=relaxed/relaxed;\r\n        d=gmail.com; s=20161025;\r\n        h=mime-version:from:date:message-id:subject:to;\r\n        bh=XwvukC6yYTsXbZ1Jsw6g3fF4j+v+k0aKND6HP291z2g=;\r\n        b=paTboiMqmLPDYXankFORSx+Sp83OQG1HT+//IMkahqSTvbb1OV1Y2V6MVOKKJY6HUS\r\n         WRc+VVQeBG1vQpLN8n65o0GWQ2JRFKeo+PD8RGOCpIFsP0qALlgNocy1+q5uizRQ1AlM\r\n         1I56pYkIsc5ynnr8wHuCZN94b3z4XA4tedLwL6TGOSmotqZ1JYjr5bGsEpfwOUzwTaYr\r\n         WT4j2rgkBGLC7ZXwepjABa3l2X1IU3MNaXa/eYYfjBczyGdYEOn6KEU0IXRxCXjkKp6o\r\n         GYKp20YxkoXHSyXr+unuIICl32V9Xv+59Gk+tCv5jgbUrMEjdHTU3KS2RbSkdeExk/yd\r\n         RzFg==\r\nX-Google-DKIM-Signature: v=1; a=rsa-sha256; c=relaxed/relaxed;\r\n        d=1e100.net; s=20161025;\r\n        h=x-gm-message-state:mime-version:from:date:message-id:subject:to;\r\n        bh=XwvukC6yYTsXbZ1Jsw6g3fF4j+v+k0aKND6HP291z2g=;\r\n        b=WzMZOUu46lJrIruJfeydPr55LlNuZMRI0mhA+TpooPt1bXuhipuoxhhT5FkulJizhq\r\n         ln8JbEzVfifM9qeolRYrl/Ebp4bZ/+NDU2P6r6JtEp6vAgiAguhVMlrpXY2ZBDQXytsy\r\n         MxDASJHtnTmWjwycw1ui1hG8dLm7vFtr3HKSgmIIOeXmIE4h5/wczpKuKgYiskW8MgYC\r\n         uFXgdGROggqhSdLqFTb/Wc0S3aPZ8CDTPAUddHbzD3HXF4jP7myG42z/wMFvEOb9K3zB\r\n         gmHFejeIrPAVhcJ4JeWANg17tyn9iu5ZW7gq2HzKhOP9gK7fskjPSJAB3JikUD91snUP\r\n         8aNQ==\r\nX-Gm-Message-State: AElRT7G1IxjezhVZd3dqz2qZDqo6uzGYJJ0cXS+djcEPps2K7w+qvptb\r\n\toU9sVBq24BVftMi7+1JK7y1z8snLfIcNrUvxiHdrMQ==\r\nX-Google-Smtp-Source: AG47ELu6BEbwIKpO4SXZwBfpAAvEQiqbVLZZTiNNkgSuzoD/QP2pd1TA3eO36VGkNIJJuP8CcaibGvBSxaV5Whunt8k=\r\nX-Received: by 10.159.61.88 with SMTP id m24mr12909329uai.65.1521644482343;\r\n Wed, 21 Mar 2018 08:01:22 -0700 (PDT)\r\nMIME-Version: 1.0\r\nReceived: by 10.31.161.20 with HTTP; Wed, 21 Mar 2018 08:01:21 -0700 (PDT)\r\nFrom: Louis Barclay <louis.barclay+janet@gmail.com>\r\nDate: Wed, 21 Mar 2018 15:01:21 +0000\r\nMessage-ID: <CAL2-1RZmRj3Wu-R57_KUgg06AGpGGqo5rbiXTDqsCPQ-5+61cQ@mail.gmail.com>\r\nSubject: 4_janet_deletion\r\nTo: Louis Barclay <louis@sundaystori.es>\r\nContent-Type: multipart/alternative; boundary=\"f403043664f8d842850567ed76b6\"\r\n\r\n--f403043664f8d842850567ed76b6\r\nContent-Type: text/plain; charset=\"UTF-8\"\r\n\r\nNOTHANKS\r\n\r\n--f403043664f8d842850567ed76b6\r\nContent-Type: text/html; charset=\"UTF-8\"\r\n\r\n<div dir=\"ltr\"><div class=\"gmail_default\" style=\"font-family:tahoma,sans-serif;font-size:small\">NOTHANKS</div></div>\r\n\r\n--f403043664f8d842850567ed76b6--\r\n"}